,id,Title,Content,Author,Post Date,cleaned_results
915,17ewbio,Realistically what happens if we keep AJ,"We would keep the 26th pick, but just for simplicity let’s say we do make that trade with the jets. 

Do we stick with Mccreary or draft Pickens?

How does the rest of the team look?",BigSimmons98,2023-10-23 21:55:45,"[('team performance', -0.31)]"
916,17euq24,Are we tanking now?,"Or do we have to trade Derrick Henry first before it’s confirmed?

Edit - Why is this being downvoted? ",jvreeland,2023-10-23 20:49:36,"[('team performance', 0.05), ('coaching and management', -0.07), ('pricing', -0.11), ('stadium atmosphere', 0.22)]"
917,17euoju,What’s next?,"We got rid of Byard, we’re 2-4, and we don’t know who’s starting qb next week. What happens next, are we gonna turn it around or are we going to titan up and do what we always do?",DaytonaBoy80,2023-10-23 20:47:48,"[('team performance', -0.12), ('coaching and management', -0.08), ('media coverage', 0.14)]"
918,17eu8p4,Was Byard even good this year?,"Don't remember seeing him make any splash plays this year. PFF grade is a 67 down from a 79 last year. It's funny the only reaction I've seen is ""lol Titans fleeced by the eagles again""",ilovezeldasfeet,2023-10-23 20:29:32,"[('team performance', -0.24), ('coaching and management', -0.06)]"
919,17eu67z,This is what people wanted…,"Can’t wait for every heart and soul member of this team to be gone and it’s a hollow shell of itself then we can see the same people bitching about “we should Tank” bitching about how we suck. Goodbye KB… please just don’t trade Henry

Edit: made post with anger and emotion after weeks of seeing people just complaining and now complaining even more when they got what they wanted",Noahgrace4429,2023-10-23 20:26:36,"[('team performance', -0.67), ('coaching and management', 0.03)]"
920,17eu1m6,The #Titans take on dead cap hits of...2023: $8.82M - 2024: $13.36M...in sending Kevin Byard to the #Eagles.,,gatordude731,2023-10-23 20:21:04,"[('team performance', -0.62), ('coaching and management', 0.1), ('miscellaneous', 0.09)]"
921,17eu0d7,The Eagles got a good 1,"So first off as a franchise the Titans were very fortunate to have a player of KB’s caliber in the secondary as long as we have . He’s definitely been the glue of our defense for years. The Mayor of Murfreesboro will definitely be missed ! 

As far as the trade goes we did receive a 5th and a 6th round pick for next years draft which is great. We need to get younger and more talented in multiple positions. Looks like Ran is gathering assets to trade up in next years draft or to fill the needs we have across our entire football team. The writing was definitely on the wall as we asked him to take a pay cut in the off-season and this is the last year of his contract. Hopefully he can Join AJ & Philly and contend for a ring for a couple of seasons. Who else do you guys think gets moved before the deadline? #TitanUp",Jazz__maintains7,2023-10-23 20:19:44,"[('team performance', 0.11), ('coaching and management', 0.24), ('media coverage', -0.1), ('stadium amenities', 0.0), ('miscellaneous', 0.1)]"
922,17ety2n,The Dream Is Really Over,,GoodShitEarl,2023-10-23 20:17:05,"[('miscellaneous', 0.06)]"
923,17etu2n,Kevin Byard wasn't going to play for the Titans in 2024. This was a good trade.,"Byard has what is essentially a team option in 2024. He can be cut with 0 dead cap. The team asked him to take a paycut this season. HE WAS NOT GOING TO BE IN A TITANS JERSEY NEXT SEASON. This is a good deal for all parties. Titans get some value for a player they weren't going to keep, Eagles get what is likely a 1 year rental for a pro-bowl safety, Titans do right by KB and send him to a contender.

This is not a ""LOL Titans GM sucks"" move. This is not a ""trade a generational WR before his prime for a 1st round pick"" move. This is a proactive (and analytical) move for a team who will now commit to focusing on the future. If Ran and Vrabes can get a 3rd for Henry who is on an expiring contract and also will not be here next year, that would be a homerun. Add in a Hop trade, Autry trade, Fulton trade if they can.

It's time to tank fellas.

Edit: Titans take dead cap hit of 2024: $13.36M, titans will still have like $70m in cap space in 2024 with Tanny, autry, and Henry off the books.",jefplusf,2023-10-23 20:12:36,"[('team performance', -0.11), ('coaching and management', 0.17), ('stadium atmosphere', -0.25), ('pricing', 0.15)]"
924,17eto1q,Titans App Might Need to be Changed — Byard,,mkrantz14,2023-10-23 20:05:47,"[('media coverage', -0.23), ('stadium atmosphere', -0.51), ('pricing', -0.09), ('miscellaneous', -0.55)]"
925,17etnvi,Titans have about $100 million in cap space next year now.,"I would hold off on the ""we're going to be trash forever"" talk. 

Last time they were in this situation they signed players like Roger Saffold and almost made it to the super bowl. 

Let Ran cook before we throw him out the door.",iMixMusicOnTwitch,2023-10-23 20:05:35,"[('team performance', -0.13), ('coaching and management', -0.15)]"
926,17etlow,"In what is sure to be the biggest #Titans news of the day, they are reuniting with a friendly face, signing veteran special teams LB Joe Jones to their practice squad.",,Minimum_Cap_5217,2023-10-23 20:02:59,"[('team performance', 0.5), ('coaching and management', 0.1)]"
927,17etkf0,It is time,,Mysteriousmoose9,2023-10-23 20:01:34,"[('team performance', -0.18), ('coaching and management', -0.32), ('miscellaneous', 0.12)]"
928,17etcrk,Terrell Edmunds Highlights 🔥 - Welcome to the Tennessee Titans,,Minimum_Cap_5217,2023-10-23 19:52:30,"[('team performance', -0.58), ('coaching and management', -0.17)]"
929,17et4qb,Do you think the titans will trade Henry?,"

[View Poll](https://www.reddit.com/poll/17et4qb)",Skippy_1308,2023-10-23 19:42:40,"[('team performance', -0.12)]"
930,17eswvr,"[Russini] The Tennessee Titans are trading All-Pro defensive back Kevin Byard to the Philadelphia Eagles. The Eagles will be sending the Titans a 2024 5th and 6th rounder and safety Terrell Edmunds, per multiple league sources.",,AcidicUrinal,2023-10-23 19:33:02,"[('team performance', -0.15), ('coaching and management', -0.26), ('media coverage', 0.0), ('stadium atmosphere', -0.04), ('miscellaneous', -0.16)]"
932,17eqv7t,Titans 31 - Falcons 10,I had a dream last night where the Titans beat the Falcons 31 to 10. The media was talking about how it was the Titans first 30 point game in forever. Also Malik started but was pulled for Levis and he came in and dominated. It was a spark of hope. Titan up,Arecotect,2023-10-23 18:07:30,"[('team performance', -0.19), ('coaching and management', 0.09)]"
933,17eqq1i,From Jim Wyatt's latest post... Did i miss something? Didn't really get the impression NPF played that much better then Dillard.,,SomethinSaved,2023-10-23 18:01:26,"[('team performance', -0.12), ('coaching and management', 0.06)]"
934,17eodub,Will Levis tush push would gain 12 yds,,bigcheeseLP,2023-10-23 16:21:37,"[('team performance', 0.04), ('coaching and management', -0.05)]"
935,17emhr0,Levis watch is upon us.,"Knowing Vrabel, we won’t get a starting qb named, until before kickoff.",titansfan92,2023-10-23 15:03:14,"[('team performance', -0.33), ('coaching and management', 0.21)]"
936,17ekzwv,Can the mods make a final “fuck J rob thread” for the AJ brown trade and we try to be done with it?,"That was a historically bad trade. It set us back an amount that it is hard to quantify. It’s embarrassing that the FO was dumb enough to pay old man tannehill instead of a near-generational WR (he may end up being generational). And AJ was just a great dude that loved the titans (until they soured it)… he literally cried when his starting QB got benched then went on to ball out with the next guy for a few years then asked for a fair contract. Sure he got a little dramatic iirc, but he was an elite franchise cornerstone that wanted to be here and deserved top WR money because that’s what he was

That said… it happened. Nothin is gonna change that. Burks appears to be mid, but guys with less talent have had slower starts than him and gone on to have good careers. There’s no real value of being annoyed when Aj does big things. He’s a good dude that deserves it, and the idiot that literally gave him away and paid the shipping is gone. Let’s see what these new guys do and stop dwelling on what could’ve been. It sucks but getting mad at the past is a terrible way to spend time as a fan 

Honestly 3 picks vs the bengals felt like a turning point for the franchise and that annoys me more than the Aj trade because it was so easy to prevent, and has had a massive snowball effect since. But fuck it. Let’s hope that mayo man can lead us back to relevance with his quick release and madden create-a-player QB build. Either that or be the best damn tank commander on this side of the Mississippi 

And as always, fuck jrob and tits up",382hp,2023-10-23 13:56:01,"[('team performance', -0.23), ('coaching and management', -0.15)]"
937,17ejj13,"The Titans have been 2-4 before, I will be called delusional but there's still plenty of football left","The doom and gloom on this site is atrocious. One crowd saying sell the team by the trade deadline. Another side sayin the team sucks and we are bottom 10 is ridiculous. The Titans aren't out of it until the final whistle is blown, idk why so many people treat the Titans like they are predictable. The Titans as a team since I could remember have been like a animal with rabies, you think they are dead, then they get up to bite you in the ass, Then they might play dead. I don't expect Titans management to trade anybody by the deadline, if they trade Henry I'm done with the Titans for the season.",Unlikely_Ad148,2023-10-23 12:45:22,"[('team performance', -0.39), ('coaching and management', -0.06), ('media coverage', -0.11), ('stadium atmosphere', 0.07), ('pricing', 0.2)]"
938,17eela4,Big ole hypothetical possibility that I just want to throw into the ether because I thought of it watching Vrabel welcomed into the Patriots ring of honor,"So, I want to start this off by saying I am 100% fine with Vrabel going to his old team and be initiated into the Patriots ring of honor. He has deserved that and much more in my opinion for his legacy with that team. 

But it got me thinking. 

Robert Kraft obviously loves Vrabel and there has been rumblings that he would not hesitate to let go of Belichick if things don't turn around. Let's say hypothetically it happens. Let's say Robert Kraft wants Vrabel to be the new head coach of the Patriots, since it seems to be he has been the only successful disciple so far as a head coach under Belichicks tutelage. 

Should we take it? Saints just received a 1st round and 2nd round pick for Payton. If Ran wants to rebuild this team in his vision and wants the draft capitol, do you think this should be something to even fathom? 

Just late night ""what ifs?"" I think about with this team since things are looking grim this far into the season.

Edit: You guys really hate hypotheticals.",gatordude731,2023-10-23 07:15:57,"[('coaching and management', 0.09), ('pricing', -0.01), ('team performance', -0.08)]"
939,17ecbpl,[Ari Meirov] “#Eagles WR AJ Brown has more receiving yards this season (809) than all #Titans WRs have combined (789).”,That damned JRob.,derrick22henry,2023-10-23 04:39:34,"[('team performance', -0.41), ('coaching and management', -0.14), ('media coverage', -0.18)]"
940,17eaws2,How many would wear them,,ScienceAltruistic694,2023-10-23 03:17:41,"[('miscellaneous', 0.11)]"
941,17earin,Splainer for the national media whenever they mention the Titans as AJ Brown dummies his opponent,,SuccoupOnDeez,2023-10-23 03:09:59,"[('team performance', 0.16), ('coaching and management', -0.34), ('media coverage', 0.03), ('miscellaneous', -0.38)]"
942,17e9cuq,Titans have taken out the shoulders of Colts’ last two franchise qb’s. That’s weird.,Strange coincidence I guess. Looks like Colts are being proactive with Richardson’s injury and learning from mistakes made with Luck. That’s my take.,Crossfieldthrow,2023-10-23 01:55:39,"[('team performance', 0.04), ('miscellaneous', -0.21)]"
943,17e96tc,The Dream Is Over,,GoodShitEarl,2023-10-23 01:46:54,"[('team performance', -0.26), ('coaching and management', -0.58), ('miscellaneous', -0.18), ('media coverage', 0.07)]"
944,17e5lcu,Any tailgates for the game @tampa?,"Me and some of my boys are going down to Tampa for the game, wondering if anyone is having a tailgate that we can come to. We will bring drinks.",Prestigious_Fan_4474,2023-10-22 22:47:18,"[('stadium atmosphere', 0.55), ('miscellaneous', 0.7)]"
945,17e2rjr,Donta Foreman,Anyone see Prince Foreman’s game? Dude still has juice!,Danny23a,2023-10-22 20:41:51,"[('team performance', 0.06), ('coaching and management', -0.03), ('miscellaneous', 0.43)]"
946,17e1vw6,Are we that bad or are the teams we’ve played that good?,"Question is self explanatory. I think we aren’t giving the teams we’ve played credit where credit is due. Our worst loss this season came against a Cleveland team that beat the 49ers with a QB in his first NFL start. Looking at how the season has played out, I think it’s fair to say we’ve lost to some pretty damn good teams. 

If Tannehill can go against the falcons, I think we come out of the bye week pretty strong. Seasons not over yet boys! TTFU",KrombopulousMichael-,2023-10-22 20:02:34,"[('team performance', -0.49), ('coaching and management', -0.45)]"
947,17e1bq6,"[Freeze] The Titans fixed Deshaun Watson just long enough for him to absolutely murder them, then they broke him again on the way out. Kinda unbelievable",,YiMyonSin,2023-10-22 19:36:55,"[('team performance', -0.1), ('stadium atmosphere', 0.0), ('coaching and management', -0.21), ('miscellaneous', -0.17)]"
948,17dztm6,Bye Week Vibes,,SweetPockets51,2023-10-22 18:28:46,"[('miscellaneous', 0.18)]"
951,17dk9yk,"[Titans] Congratulations Coach Vrabel, the newest member of the New England Patriots Hall of Fame!",,YiMyonSin,2023-10-22 03:36:15,"[('coaching and management', -0.17), ('miscellaneous', -0.08)]"
952,17dc1ri,"[Glennon] Jeffery Simmons fined $11,473 for unnecessary roughness in 2nd quarter of last week’s loss to Ravens",,YiMyonSin,2023-10-21 20:48:23,"[('team performance', -0.13), ('miscellaneous', -0.09)]"
953,17dbzq2,Shiny New Titans… + Kearse 😂,"Chat me if you want ‘em! Combination of clearing out space, giving someone else the memories I’ve enjoyed, and pitching whatever I can into my engagement ring fund.",Few_Moment7990,2023-10-21 20:45:35,"[('team performance', 0.25), ('miscellaneous', 0.6)]"
954,17d87ob,"[Kleiman] NFL Teams have called the #Titans about trading Pro-Bowl safety Kevin Byard and WR1 Treylon Burks, per @DMRussini",,Julonix,2023-10-21 17:50:49,"[('team performance', -0.04), ('coaching and management', -0.34), ('media coverage', 0.05), ('miscellaneous', -0.15)]"
955,17d52wv,Shopping Cart Race,"Who had the best record? I feel like Molly Moo and Texas Pete were always cleaning up. The bunny bread bunny never delivered on his potential. Would be awesome if someone kept track of this.

Also they retired this right? Haven’t seen it at a game in a couple years.",GhostsnLights,2023-10-21 15:27:36,"[('stadium amenities', 0.09), ('miscellaneous', 0.07)]"
956,17d3fne,Henry hit 20.99 mph on 63 yard run out of the wildcat,Big man still fast,shittyfingers,2023-10-21 14:10:41,"[('team performance', -0.27)]"
957,17d0nuv,No franchise offensive leader was not also a Houston Oiler,"The franchise has been in Tennessee long enough that I was surprised to note that no franchise all time leader in rushing, passing, receiving, or scoring was not also a Houston Oiler.  This actually surprised me, particularly in the recent era of football where offense has been highly favored.  King Henry has a chance to, well, claim the rushing throne, at least, and be the first franchise leader who is “pure Titan”.

Passing:  Moon
Rushing:  George
Receiving:  Givins
Scoring:  Del Greco",DrJupeman,2023-10-21 11:41:20,"[('team performance', -0.03), ('coaching and management', -0.08), ('media coverage', 0.02)]"
958,17ctjq3,Is Tannehill the second best QB to ever play for the Titans? (Not including Moon only QBs who played as a Titan),While it looks like Tannehills Titan and possibly even NFL career is over we need to remember the great years he gave us. While doing so I think I realized that Tannehill is the second best QB to ever wear a Titans uniform and third best QB in the Oilers/Titans history.,DickThunders,2023-10-21 03:38:46,"[('team performance', 0.01), ('coaching and management', -0.15)]"
959,17cpkvj,Who’s the team you’re rooting for since this clearly isn’t our year?,"For me, I think it’s the Lions.

To be clear, I’ll always root for the titans. Just seeing what people think as a second team we can root on. I always find myself excited when the lions win. Dan Campbell reminds me a little of vrabel.",Deuce-Juicin,2023-10-21 00:12:41,"[('team performance', -0.08), ('coaching and management', 0.11), ('miscellaneous', 0.04)]"
960,17cm13w,I'm a time traveler and will answer all of your Titans questions.,"After taking the Aaron Rodgers route of medicating through illicit hallucinogenics, I've returned from January 2025 to answer your questions about the Titans and how we square up following this bye. 

Since I already know what will happen, I'll respond to your questions before you ask them.",bloated_canadian,2023-10-20 21:29:56,"[('team performance', -0.08), ('stadium atmosphere', 0.09), ('media coverage', 0.01), ('miscellaneous', 0.05)]"
961,17cks3e,At the Football Hall of Fame today,,Gats775,2023-10-20 20:34:54,"[('team performance', -0.29), ('miscellaneous', 0.15)]"
962,17cdyc6,Could Ryan Tannehill’s contract impact Titans return-to-play timeline?,,YiMyonSin,2023-10-20 15:28:46,"[('team performance', -0.24), ('coaching and management', 0.13)]"
963,17cdw8o,"[GMFB] Titans RT Chris Hubbard shares about how his foundation ""Overcoming Together"" is raising awareness for mental health",This sub could use a little positivity.,Pork_Chompk,2023-10-20 15:26:11,"[('miscellaneous', 0.35), ('coaching and management', -0.49)]"
964,17c9h41,Its nice having someone whos been there done that give their point of view on things.,,Own_Manner_9779,2023-10-20 11:53:26,"[('team performance', -0.2), ('coaching and management', -0.35)]"
965,17bzhsu,Wonder if dhop is feeling the same kind of way,,SomethinSaved,2023-10-20 01:34:50,"[('team performance', -0.21), ('miscellaneous', 0.07)]"
966,17by82z,How we all feeling?,,Irish-Titan,2023-10-20 00:31:44,"[('team performance', -0.67), ('coaching and management', -0.46), ('miscellaneous', -0.18)]"
967,17bvszk,"Should Levis start vs falcons? If so, I might be 2 for 2 in QB retirements","Im a “long-distance” fan living in Scandinavia.  I started following Titans in 2006 and was a huuuuuge VY fan. 

My first Titans game in stadium was against Washington in the 2010 season. Yes, Vince Youngs last game. I got to see him play live and he never saw the field again in a Titans uniform. 

Last weekend I went to my second Titans game. This time in London. That could be the last game with Tannehill. If so, I will be 2 for 2 in Titans QB retirements 😂 

If you need a QB retirement, just buy me tickets 😂 

On a more serious level. Time to rebuild. Get whatever draftstock we can for Henry. Even though I love that man. Let Levis and Spears run the offense from here. 

Thanks for the memories, Tannehill. Especially the playoff run ending with losing the AFC Champs game.",MLind90,2023-10-19 22:38:12,"[('team performance', 0.13), ('coaching and management', 0.18), ('pricing', 0.0), ('media coverage', -0.13), ('miscellaneous', 0.06)]"
968,17bter7,Should the Titans resurrect the corpse of Sammy Baugh and sign him?,,Drackenstein,2023-10-19 20:56:29,"[('miscellaneous', 0.04)]"
969,17bsdtp,John Glennon: Time for Titans GM Ran Carthon to put 'for sale' sign on roster,,regardingeggs,2023-10-19 20:12:18,"[('team performance', -0.11), ('team performance', -0.12), ('team performance', -0.3), ('team performance', -0.15), ('team performance', -0.09), ('team performance', -0.14), ('team performance', -0.09), ('team performance', -0.06), ('team performance', -0.23), ('team performance', -0.09), ('team performance', -0.19), ('team performance', -0.16), ('team performance', 0.23), ('team performance', 0.06), ('team performance', -0.19), ('team performance', -0.09), ('team performance', -0.06), ('team performance', -0.14), ('team performance', -0.23), ('team performance', -0.12), ('team performance', 0.06), ('team performance', 0.28), ('team performance', -0.06), ('coaching and management', -0.09), ('coaching and management', -0.04), ('coaching and management', -0.01), ('coaching and management', -0.02), ('coaching and management', -0.06), ('coaching and management', -0.19), ('coaching and management', -0.09), ('coaching and management', -0.09), ('coaching and management', -0.06), ('coaching and management', -0.05), ('coaching and management', 0.0), ('coaching and management', 0.19), ('media coverage', -0.39), ('media coverage', 0.2), ('miscellaneous', 0.2), ('miscellaneous', -0.06), ('miscellaneous', -0.08), ('miscellaneous', 0.28), ('miscellaneous', -0.34), ('miscellaneous', -0.04), ('miscellaneous', -0.16), ('miscellaneous', -0.08), ('miscellaneous', -0.08), ('miscellaneous', -0.11), ('miscellaneous', 0.11), ('miscellaneous', 0.08), ('miscellaneous', 0.22)]"
970,17bs2co,"[MLFootball] “🚨ODDS🚨#Raiders superstar WR Davante Adams next team if traded 1) #Bills, 4/1 2) #Lions, 5/1 3) #Titans , 5/1 4) #Browns, 6/1 5) #Giants, 6/1 6) #49ers, 7/1 7) #Packers, 7/1 8) #Cowboys, 9/1 9) #Bengals, 11/1 (Via @betonline_ag)”",,derrick22henry,2023-10-19 19:59:13,"[('team performance', -0.28)]"
971,17brpxz,[OC] Rate of dropbacks where team had N number of open receivers on the dropback (ie: zero = zero receivers open on the dropback),,Tom1664,2023-10-19 19:44:19,"[('team performance', -0.11), ('media coverage', -0.07)]"
972,17bpsuw,Should Titans trade for Terrace Marshall?,"He has shown flashes of being good and probably wouldn’t cost the Titans more than a day 3 pick.

What do you think? Should he be on Ran’s radar?",Fux2Cum69,2023-10-19 18:21:45,"[('team performance', -0.27), ('coaching and management', -0.13)]"
973,17bpkro,"Announcers for Titans/Falcons: Beth Mowins, James Lofton, Hay Feely and Amanda Guerra",,gonshpreds1,2023-10-19 18:12:09,"[('media coverage', -0.67), ('stadium atmosphere', -0.44), ('team performance', -0.85), ('coaching and management', -0.85), ('media coverage', -0.38), ('stadium amenities', 0.8), ('stadium atmosphere', -0.93), ('pricing', -0.84), ('media coverage', -0.72), ('stadium atmosphere', -0.59)]"
974,17blddd,What will Titans management decide?,"Given the current fan base uncertainty as it seems, what is your opinion of what Titans management may be thinking? Is the season a wash? Is it a waiting game? Is it time to trade away one of our beloved immortals?

[View Poll](https://www.reddit.com/poll/17blddd)",Rocket2112,2023-10-19 15:07:20,"[('team performance', -0.01), ('coaching and management', 0.27), ('pricing', 0.02)]"
975,17bjrj4,"Objectively, this was dirty. Not a fan of this type of shit, Big Jeff","Big Jeff almost took out like 4 knees on this hit, c'mon man",screaminNcreamin,2023-10-19 13:56:41,"[('team performance', -0.24), ('coaching and management', -0.1), ('media coverage', -0.04), ('stadium amenities', 0.33), ('stadium atmosphere', 0.12), ('pricing', 0.15), ('miscellaneous', -0.32)]"
976,17bjn2n,It is the way,,DickThunders,2023-10-19 13:51:07,"[('team performance', -0.06), ('coaching and management', -0.22), ('stadium atmosphere', 0.15)]"
977,17bjd0g,Trade deadline coming up. Should we go after Russell?,"Word is, that Denver is ready to unload the entire team.",Top-Abbreviations582,2023-10-19 13:38:25,"[('team performance', -0.61), ('coaching and management', -0.2)]"
978,17b715j,"NFL Team Tiers by EPA/Play, Weeks 1-6",,Toddric29,2023-10-19 01:23:21,"[('team performance', 0.0)]"
979,17b6yt6,The tonal shift of this sub week to week is crazy,,amackul8,2023-10-19 01:20:14,"[('team performance', -0.12), ('coaching and management', -0.07)]"
980,17b58vj,"""Rent Henry for the year?"" currently on the Lions subreddit. What would be the realistic asking price?",,Xatron7,2023-10-18 23:57:20,"[('team performance', -0.07), ('coaching and management', 0.03), ('stadium amenities', 0.08), ('miscellaneous', -0.11)]"
981,17b0q1n,[ThatsGoodSports] “Through six games Ryan Tannehill has just 1 more passing touchdown than Derrick Henry. Tannehill 2 King Henry 1”,,derrick22henry,2023-10-18 20:38:19,"[('team performance', -0.72), ('coaching and management', -0.28)]"
982,17b0njq,"[Kleiman] Crazy story from the #Ravens-#Titans game on Sunday. Turns out Odell Beckham and Jeffery Simmons got into a fight after the game. Simmons was looking for Odell, after the fight started Ravens players had to call security to break it up, according to @marlon_humphrey","Rest of tweet: ""Simmons wanted that fade from (Odell)."", adding Odell was grabbing his facemask during the fight.

The two had an incident during the game, with Odell kneeing Simmons when he was on the ground. OBJ was apparently defending his teammate Zay Flowers after a late hit. 

More here:
brobible.com/sports/article…",ReAlignTitan,2023-10-18 20:35:24,"[('team performance', -0.05), ('stadium atmosphere', 0.07)]"
983,17axolr,Titans Season Turning around Confirmed,"Die hard fan, playing 18 today and found this Ball in the Rough on the Par 5 Fifth. Never had a Titans golf ball, and the course is in Maine. If this isn’t a sign I don’t know what is. We are about to turn this shit around!",DirkDiggler2424,2023-10-18 18:28:01,"[('miscellaneous', 0.22)]"
