,id,Title,Content,Author,Post Date,cleaned_results
454,17q0ipz,Unpopular Opinion: Tannehill should start if he’s healthy.,"We’re thin at receiver and I’m told he has some experience at the position in college. He also beat Malcom Butler in a race that one time. A big, physical receiver with straight line speed is the weapon Levis needs to unlock this offense and to develop as this franchise’s QB moving forward. Tannewheels was born for this. 

TL;DR: That’s my WR2. League’s fucked.",More_Advertising_383,2023-11-07 18:13:41,"[('team performance', 0.11), ('coaching and management', -0.14)]"
455,17pzhs4,Planning a trip for a game,"Me (Titans fan) and my buddy (Jags fan 😔) are planning to travel to Nashville for the game in January. Never really spent much time and never been to a game IN NASHVILLE. I’ve been to Titans games at about 7 other stadiums though ha.

We’re coming in Friday and staying til Monday. I am curious if anyone has advice on where to stay, what hotels to look at, if tailgating is good at the stadium or we should just go into the stadium. If there’s a section you think is best for tickets, etc.


Bonus points if you have recommendations for things to do and places to eat that you love in the city.

Will likely post in a Nashville travel sub but thought my brothers in misery would have some great advice specific to the Tits.

Titan up!",Costco-Hotdogz,2023-11-07 17:29:00,"[('stadium amenities', 0.11), ('stadium atmosphere', -0.08), ('miscellaneous', 0.08)]"
456,17pzdtg,Who did this? 😭,,Chisae69,2023-11-07 17:24:10,"[('team performance', 0.05), ('coaching and management', -0.09), ('pricing', 0.29)]"
457,17pyr9d,"[Tom Pelissero] “The #Titans are waiving DT Naquan Jones, per source. A bit of a surprise, given Jones has played a lot there (32 games over three seasons). A big body available on waivers.”",,derrick22henry,2023-11-07 16:56:51,"[('team performance', -0.18), ('coaching and management', -0.07), ('miscellaneous', 0.05)]"
458,17pxquu,So how we feeling about Coach Vrabel’s presser later today?,"

[View Poll](https://www.reddit.com/poll/17pxquu)",TiredDad1994,2023-11-07 16:11:04,"[('coaching and management', 0.0), ('team performance', -0.07)]"
459,17pwdj1,You don’t see a guy like Patrick Peterson giving these type of endorsements too often.,,TiredDad1994,2023-11-07 15:09:50,"[('miscellaneous', 0.08)]"
460,17pux33,[Kuharsky] Titans through 9 weeks:,,YiMyonSin,2023-11-07 14:00:23,"[('team performance', -0.15), ('coaching and management', -0.08), ('stadium atmosphere', 0.0)]"
461,17plyiu,Titans are one of the best teams in the league rn,"Titans beat the chargers —> Chargers beat the Jets —> Jets beat the Eagles

TITS ALWAYS ON TOP BABY!!!!!",Frosty_Battle_6479,2023-11-07 04:06:13,"[('team performance', 0.22), ('miscellaneous', -0.05)]"
462,17pk98w,Shots fired,,enIighten-me,2023-11-07 02:34:23,"[('team performance', -0.08), ('coaching and management', 0.11), ('stadium atmosphere', 0.5)]"
463,17pjep7,Opinion: Patriots’ Interest in Mike Vrabel Nothing but a Pipe Dream,,YiMyonSin,2023-11-07 01:52:02,"[('coaching and management', -0.1), ('team performance', -0.05), ('media coverage', 0.07), ('miscellaneous', 0.06)]"
464,17pgqjf,"Schultz: Former #Steelers WR Martavis Bryant is working out for the #Cowboys tomorrow and plans to workout for the #Titans after that if there's no deal with Dallas, sources tell @BleacherReport.",,udub86,2023-11-06 23:41:58,"[('team performance', -0.19), ('coaching and management', -0.05), ('miscellaneous', 0.07)]"
465,17pcf91,Interesting Henry stats.,,GoobieWoobieLover,2023-11-06 20:38:55,"[('team performance', 0.05), ('stadium atmosphere', 0.0)]"
466,17pc9uc,Tanny Stans couldn't even comprehend the despair of a Malik Truther ,,amackul8,2023-11-06 20:32:07,"[('miscellaneous', -0.12)]"
467,17pbrp1,I Am Sick And Tired Of Players Trying To Hitstick The Ball Carrier.,"I'm tired of watching people bounce off our defense because nobody wraps up anymore.

You want to force a fumble? Tackle the guy. Let whoever comes in second do the punching.

It's so infuriating to watch our guys lower a shoulder rather than hug the runner.

Everyone wants to end up on a highlight reel. And they do, getting blown up and scored on. 

I'm angry.",LaSandiaPicante,2023-11-06 20:10:31,"[('team performance', -0.16), ('stadium atmosphere', 0.18)]"
468,17pblyk,Patriots have ‘home run’ hire in mind to replace Bill Belichick,"I hope this doesn't happen, but I can definitely see it playing out.",tntitan08,2023-11-06 20:03:27,"[('coaching and management', 0.29), ('team performance', -0.02), ('media coverage', -0.15), ('miscellaneous', -0.07)]"
469,17pauxp,Deciding which player i should get as my Oilers Jersey,"

[View Poll](https://www.reddit.com/poll/17pauxp)",saradahokage1212,2023-11-06 19:31:17,"[('team performance', 0.15), ('coaching and management', -0.05), ('stadium amenities', 0.05), ('stadium atmosphere', 0.21), ('media coverage', -0.02), ('miscellaneous', 0.31)]"
470,17parra,Vrabel is a good coach and should stay. Vrabel also does dumb shit. Both can be true.,Why can’t there any fucking nuance here? Everything’s black and white. Does Vrabel do dumb shit like trusting his coaching buddies too much and not backing Levis? Yes. Has Vrabel already accomplished more than 90% of coaches and deserves at least this year and next? Yes. The confusing thing is everyone who wants him gone also believe we have the worst roster in football. So how can he be successful anyways then? 90% of coaches flame out within their first few years. So you better either ride with him at least until we get the roster fixed next year or just find the next Mike Mcdaniel. Since apparently that’s so fucking easy lol.,FuckFloridaRipNumba9,2023-11-06 19:27:30,"[('team performance', -0.14), ('coaching and management', 0.03), ('media coverage', -0.13), ('miscellaneous', 0.07)]"
471,17p93yt,"[NFL Football] 23 Titans use of Derrick Henry vs Tyjae Spears with 5 mins left in the half: Henry 22 snaps, Spears 67 snaps From 20-22 Henry has only been the RB on field 40.5% with 5 mins left. Why pay $50m to a player who watches the offense when they need to score in critical situations?",,I-hate-the-pats,2023-11-06 18:15:55,"[('team performance', -0.17), ('coaching and management', -0.07)]"
472,17p6t87,[Kuharsky] Titan’s Nicholas Petit-Frere to have shoulder surgery,,jansen2442,2023-11-06 16:37:41,"[('team performance', -0.2), ('coaching and management', -0.18), ('media coverage', -0.18), ('stadium amenities', 0.0), ('stadium atmosphere', 0.05), ('miscellaneous', -0.23)]"
473,17p687c,"They're still overpriced, but authentic Oiler jersey's are about $120 off (for the first few months they were excluded from any discounts)",,382hp,2023-11-06 16:11:14,"[('pricing', -0.7), ('stadium amenities', 0.05), ('miscellaneous', -0.16)]"
474,17p60pn,Henry TD Watch,"https://www.pro-football-reference.com/leaders/rush_td_career.htm

Henry is now tied with Corey Dillon for 18th all time in rushing TDs.  If he can manage another 5 before the end of the season they would give him 87 and put him ahead of Priest Holmes for some position of 15th all time.",panopticon31,2023-11-06 16:02:03,"[('team performance', 0.19), ('media coverage', 0.05)]"
475,17p46ma,"[Football & Other F Words] Before we set sail, some Titans Offense Efficiency Stats",,YiMyonSin,2023-11-06 14:38:57,"[('team performance', 0.09), ('coaching and management', 0.15)]"
476,17ovbcx,Just my thoughts about the possibility of firing Vrabel if he doesn't start Levis next week,"Vrabel earned Coach of the Year after leading the most injured roster in the league (and it wasn't even close) to the first seed in the playoffs.

Vrabel wanted to keep AJB because he knew the damage it would do if we didn't keep him, and he was right.

Vrabel benched Mariota for Tannehill in 2019 because we had an actually good roster that he knew wasn't playing up to its full potential unless Tannehill was put in.

All that to say, he has been right about everything so far.  Trust the process.  If he benches Levis, I trust that he has his reasons, and I suspect those consist of the fact that we do not have a competitve roster around Levis like we did in 2019.  Levis is 100% a breath of fresh air over Tannehill, but he could understand that us fighting tooth and nail for a 1 and done in the playoffs and a lower pick in the draft isn't the move.",TheWetNapkin,2023-11-06 05:03:00,"[('team performance', 0.01), ('coaching and management', 0.12)]"
477,17ou6qc,"Back up the Brinks truck for Higgins, bring back D-Hop, draft a speed guy in the mid rounds",This is the only answer,TiredDad1994,2023-11-06 03:54:56,"[('team performance', -0.05), ('coaching and management', -0.02), ('stadium amenities', 0.0), ('stadium atmosphere', 0.0), ('pricing', -0.08), ('miscellaneous', 0.06)]"
478,17otviy,Hear me out,,TayJames2,2023-11-06 03:36:32,"[('team performance', -0.18), ('stadium atmosphere', 0.03), ('coaching and management', -0.05), ('miscellaneous', -0.07)]"
479,17oszjf,"To Titans fans who want Vrabel gone, it can always get worse",,Broberg11,2023-11-06 02:49:53,"[('coaching and management', 0.23), ('team performance', -0.18), ('stadium atmosphere', 0.0)]"
480,17osry2,"The more he plays, the greater the injury risk","Let's be honest. Titans aren't playoff bound this year. Given the poor Oline play it seems like putting in Levis the rest of the season is just going to get him injured. Plus, Levis appears to have learned quite a bit after sitting the beginning of the season. Wouldn't it make more sense in the long run to play Tannehill if he's healthy?",YupikShaman,2023-11-06 02:38:35,"[('team performance', -0.18), ('coaching and management', 0.11)]"
481,17orgex,Every. Time.,,believes_cubic_time,2023-11-06 01:30:56,"[('team performance', 0.18), ('coaching and management', -0.19), ('miscellaneous', 0.02)]"
482,17opzim,‪We sent the Mayor of Murfreesboro over to Philly just so he could get called washed up by the NFL’s most disrespectful fan base.,At least got picks ¯\_(ツ)_/¯,TiredDad1994,2023-11-06 00:17:44,"[('team performance', 0.08), ('coaching and management', -0.14), ('media coverage', -0.12)]"
483,17onpfz,[Tres Winn] If you think Vrabel should be fired cause… they lost a game with a bad roster; Please don’t back off your comments when the #Titans win a Super Bowl with him.,,TySoprano,2023-11-05 22:33:32,"[('team performance', -0.18), ('coaching and management', -0.12)]"
484,17on7qt,The case for firing Mike Vrable,"1) I think Will Levis is the real deal. I think he can be as special as any QB we have had since being in Nashville. Having an offensive minded coach will help him. Someone that can develop him. Young Qb always benefit from a good offensive mind. 

2) look at the past Super Bowl coaches 

Andy Ried vs Nick Sirianni

Sean McVay vs Zac Taylor 

Bruce Arians Vs Andy Ried 

Andy Ried vs Kyle Shanahan 

Bill Bellchick vs Sean McVay

Doug Peterson Vs Bill Bellchick 

All of them with the exception of bellchick are offensive minded. And even bellchick I think you have to make an exception for because he had Brady.

3) If Vrabel had some mastermind offensive coordinator, it be little better. But he dosent. He hire’s underwhelming offensive coordinators that he hires within instead of outside the organization 

4) The culture is the titans has always be physical run first. Dominate the line of scrimmage. Well we don’t do that. When last time the offensive line dominated. Additionally it’s a passing league. Run first teams without a good passing game do not win.

5) He a defensive coach. Witch means you think we be a top defense. Are defense has only had one top 10 finish and that was his first year. This should be his strength and it’s a weakness 

2023: 20th ranked defense 

2022: 23rd ranked defense 

2021: 12th ranked defense 

2020: 28th ranked defense 

2019: 21st ranked defense 

2018 8th ranked defense 

Probably get downvoted. But I want a young offensive coach to help Levis instead of this old school mindset that does not work in 2023 especially when your defense has been below average and your a defensive coach.",titans1fan93,2023-11-05 22:12:05,"[('team performance', -0.46), ('coaching and management', -0.09)]"
485,17on6s4,Buccaneers fan here....so uh... what are we doing next week?,"Seems like both of our teams are in a similar situation.

We are both worse than what we should be. We seem to be able to reach the playoffs with a bit of luck but every fan realistically is not even thinking about that.

HOWEVER, whoever wins next week will definitely start doing the math.

What's the goal for your team. Are you on the ""let's win games and start building up the winning mentality for the next season"" train or is the consensus ""tank this season, Levis is the future"" or whatever?

Cause I am not sure what's better next week. Are both teams trying to win? Are both teams trying to lose? Are  both teams trying to less-suck each other?",dragonsky,2023-11-05 22:10:53,"[('team performance', -0.07), ('coaching and management', 0.17), ('pricing', 0.18), ('miscellaneous', -0.08)]"
486,17olcyp,Titans’ Drives Week 1 - 8,,-LilPickle-,2023-11-05 20:49:56,"[('team performance', -0.04), ('stadium atmosphere', 0.13), ('coaching and management', -0.26)]"
487,17ogimc,2024 is gonna be a MOVIE,,TiredDad1994,2023-11-05 17:12:01,"[('coaching and management', 0.23), ('pricing', -0.38), ('miscellaneous', 0.35)]"
488,17odq8e,Other Games Around the NFL Thread,Use this thread to talk about happenings this Sunday. ,YiMyonSin,2023-11-05 15:01:07,"[('team performance', -0.05)]"
489,17oc4q5,We made it to the promise land boys!,My dog and I have been on a roadtrip since oct 6th.,Gats775,2023-11-05 13:38:17,"[('stadium amenities', 0.0), ('stadium atmosphere', 0.22), ('team performance', 0.08)]"
490,17o76tq,Are we making the playoffs?,"Surly we have to, right? Henry will get it going the second half of the season, right? Levis is good enough, right? Our Oline is better with Skonk, right? Chig and Trey will get better now, right?

RIGHT??",Lischeyave,2023-11-05 08:02:22,"[('team performance', -0.18), ('pricing', -0.16), ('coaching and management', 0.16)]"
491,17o524l,Simple question,Do you guys honestly believe we still have a shot of making the playoffs?,johnallingham19,2023-11-05 05:20:16,"[('team performance', -0.05), ('media coverage', 0.0), ('miscellaneous', 0.24)]"
492,17o4j0y,Going through a box of old cards and found all these.,Apparently I had a thing for McNair cards back in the day. Some of those Titans jerseys are definitely photoshopped on.,JWright68,2023-11-05 04:44:13,"[('miscellaneous', 0.14)]"
493,17o0wgm,Levis article w/ childhood stories,"So I found this random Levis article from just before the draft, “Even in middle school, NFL draft prospect Will Levis was gifted leader: 'Throw a little slower” the article itself sucks it’s littered with ads and typos. But check out these stories from people who knew him as a child.

In talking with a couple of people who knew Levis as a young teen, they describe a middle schooler who was already a leader with preternatural poise.

He also already had an arm.

“At recess, we allowed the kids to play football,” said Chris Wallack, the school’s former athletic director, who’d sometimes be the teacher out at recess. “We had fifth and eighth graders together. The first few times we went out with Will, everybody wanted to throw the football around. He threw so hard – not purposefully – so hard, he knocked down some kids.

“A private school, there were parents who probably wouldn’t have let their kids play football, with concussions or whatever, doctors. I remember having to tell him, hey, when you’re throwing to the fifth graders, you’ve got to throw a little slower.”

John Fixx, now head of school, arrived at the Country School in 2013 so was only around Levis for one year. He made an impression.

“We knew when he was here he was going to take a leadership position,” Fixx said.

Wainio said that Levis was the kind of guy who always had a smile, who had a big laugh. And none of that took away from his poise or tenacity.

“We were losing to a team in basketball by about 16 points at halftime,” Wainio said, “and Will came out in the second half and scored 32 points, in a middle school basketball game. That was my first notion that this kid had something a little different.”

Wallack remembered meeting with Levis’ parents after Will was cut from Madison’s top travel basketball team to the B-team. He said he told them that they had a motivated youngster and a little adversity might make him stronger.

“And hey, he’s also going to play Country School basketball,” Wallack said. “He can take out some of his frustrations at being cut.”

A few weeks later, in the first game of the school season, Wallack said, Levis scored 43 points.

“We were a school where the whole team might not score 43 points in a game,” Wallack said. “He had a great two years. the B-team thing, I think it worked out.”

Wallack remembered Levis as a pretty good lacrosse player as well.

“He was pretty good at everything.”

All three described a magnetic personality that helped make Levis a leader. He was popular with his other students, Fixx said, but had something more, was able to plan ahead.

“When others could fall off the rails and be typically eighth-grade silly, he focused on maintaining appropriate comportment,” Fixx said, pausing to get that last word. “Deportment and comportment. He showed me a maturity beyond his years early on. He was a leader that way.”

Wallack said he talked with other coaches about the idea of Levis taking the Wonderlic test, similar to an IQ test that was famous as an NFL evaluation tool for draft prospects.

“I don’t know if they still do that, but if they did, this kid, he’d get 100 or whatever that score would be,” Wallack said. “He’s a smart kid, a really good kid. Skills aside, we think he’s got the fortitude, the motivation to be a very good NFL quarterback.

“He’s such a nice kid.”

[https://www.ctinsider.com/gametimect/football/article/Football-Xavier-QB-Will-Levis-dream-becomes-17094188.php](https://www.ctinsider.com/gametimect/football/article/Football-Xavier-QB-Will-Levis-dream-becomes-17094188.php)

&#x200B;",TitanFan0521,2023-11-05 01:20:03,"[('miscellaneous', 0.54), ('team performance', 0.05)]"
494,17nzead,Is Will Levis cocky? A video about him from April of this year:,,CaffeinatedDiabetic,2023-11-05 00:05:50,"[('coaching and management', 0.31)]"
495,17nz8wc,ICYMI: Some words from Treylon Burks after Thursday’s scary injury,,TiredDad1994,2023-11-04 23:59:05,"[('team performance', 0.13), ('stadium atmosphere', -0.19), ('miscellaneous', 0.08)]"
496,17nnm0o,"[Quoting Ben Violin] “Two sources close to the Patriots have independently said the same thing: They believe Vrabel, currently the Titans’ coach, is the Krafts’ “home run” choice to succeed Belichick.” Acknowledges that he’d have to be acquired via trade, & that Kraft did trade for Bill B in 2000",,SpyroHinch,2023-11-04 15:07:22,"[('team performance', -0.26), ('coaching and management', -0.09), ('media coverage', 0.05)]"
497,17nni8s,Random question for the OG fans,"I’m not sure if they still use this, but the music they use to play at games back in the day and at the end it says GO. TITANS. GO. 

I understand that’s super vague crowd music. But I know someone here knows what I’m talking about. Someone hit me with a link for it!!",TennKare26,2023-11-04 15:02:35,"[('stadium atmosphere', -0.03), ('media coverage', 0.04), ('miscellaneous', 0.05)]"
498,17nmy77,Another Post Speculating Vrabel doesn’t convey his genuine thoughts to the media,"1) we all used to know this about Mike
2) every player is different and we know he has a different approach to managing each player

Consider for a moment, that Mike is trying to develop his young QB with these media responses and decisions. Will was known to be cocky.

A helpful thought experiment- pretend for a moment that Vrabel is very intentional and doing the right thing for the team and then reevaluate everything he says for an ulterior motive. 

None of us know Will or the team as well as the coaching staff. That’s a fact. 

For all we know Vrabel may start Tannehill to develop Will further. There’s something to be said for not letting your rookie QB get smushed by our awful O line play as well. 

These are ideas it seemed the collective consciousness of the sub used to acknowledge. I remember people saying we are “ruining” Malik behind this O line. Where is that thought for Will?

I remember people acknowledging that Vrabel was a leader of men. Suddenly he’s a favorites playing loser who likes losing?

We all said the season is shot, now being patient with Will is us surrendering the season?

It just doesn’t add up.

That said… the play calls at the end of the game sucked. I think the run on 3rd and 4 was us outsmarting ourselves. And as painful as it is to admit — Will sucked that series. Not in that he didn’t make plays, but in that he was hurling the ball into the hands of the Pittsburgh D and looked lost.",thanoski,2023-11-04 14:34:27,"[('coaching and management', 0.33), ('team performance', -0.35), ('media coverage', -0.08)]"
499,17nm6er,Best Documentary McNair,"I'm an old Oilers fan (grew up in Houston, live in Kansas) and become obsessed with Titans this year. Anyway, I wasn't following football when McNair stuff happened. Is there book or video documentary that any of you could recommend to learn about that? Googling brought up too much. ",Flamingo1836,2023-11-04 13:55:39,"[('media coverage', 0.17), ('miscellaneous', -0.5)]"
500,17nkhm4,"[James Foster] 3 - lost contain once, but really solid outside of that",,TySoprano,2023-11-04 12:20:16,"[('team performance', 0.26), ('coaching and management', -0.03), ('stadium atmosphere', -0.05), ('miscellaneous', 0.04)]"
501,17njko6,Top 5 and Bottom 5 PFF grades from Thursday.,Nice to see Phillips and Radunz up there. Sam Monson mentioned mentioned most of the damage to Levis grade came on that last drive with 3 turnover worthy plays,ilovezeldasfeet,2023-11-04 11:21:10,"[('team performance', -0.03), ('team performance', -0.67), ('team performance', -0.13), ('team performance', 0.1), ('team performance', 0.08), ('team performance', 0.13), ('coaching and management', -0.07), ('coaching and management', 0.05), ('coaching and management', -0.17), ('coaching and management', -0.07), ('coaching and management', -0.05), ('coaching and management', 0.1), ('coaching and management', 0.09), ('coaching and management', 0.05), ('coaching and management', 0.06), ('coaching and management', -0.01), ('coaching and management', -0.05), ('coaching and management', -0.13), ('coaching and management', 0.0), ('coaching and management', -0.05), ('coaching and management', -0.06), ('coaching and management', -0.05), ('media coverage', -0.05), ('media coverage', -0.2), ('media coverage', 0.21), ('media coverage', -0.1)]"
502,17nd2gt,We are currently 12th in the draft order. I think we win 3 more games. Where does that put us?,,Need-A-Vacation,2023-11-04 03:37:37,"[('team performance', 0.19), ('pricing', -0.03), ('miscellaneous', -0.03)]"
503,17nby48,Tennessee Titans Subreddit 2023,,PuffMagicDragon,2023-11-04 02:35:13,"[('miscellaneous', 0.17)]"
504,17napwt,How are feeling about Ran Carthon now?,"Good: draft, so far

Bad: Dillard signing, Byard trade

I need more insight

EDIT: Good insights. Dhop good, Al-shair good, SMB good, Byard trade actually good, Key…? ",InsanoVolcano,2023-11-04 01:31:46,"[('coaching and management', 0.32), ('team performance', 0.25)]"
505,17nagnp,Precious King 🤴🏿🐐🐐,,Minimum_Cap_5217,2023-11-04 01:18:25,"[('team performance', 0.15), ('coaching and management', -0.08)]"
506,17naasu,I Wouldn't Be The Least Bit Surprised To Learn,"That the team dreads being praised by Vrabel in the media because it means ya done fucked up and they love when he drags them because it means he's proud.

Like when I relentlessly tease my friends and am generally polite to people I hate.

Vrabel seems like the type of coach to tell his players ""don't listen to anything I tell the media, they're a bunch of parasites. Listen to what I say in this locker room.""",LaSandiaPicante,2023-11-04 01:10:13,"[('coaching and management', 0.45), ('media coverage', -0.18)]"
507,17n7jm8,I think we have legitimate Pro Bowl players on our team,"I feel like we’ve got some great guys this year. No one is talking about Azeez Al-Shaair. He is averaging just over 10 tackles a game this year, 5 solo a game. He needs to be getting more props, especially for an undrafted kid when all they talk about is how great Mr. Irrelevant is.

Our kicking game is top-notch. Nick Folk is 100% from everywhere. Amazing. And Stonehouse is just as good and getting it within the 10 so often. And considering that, I vote Morgan Cox for a repeat!

These are just the guys that I feel don’t get talked about enough but are making a huge impact. Even if it isn’t something big, they aren’t making mistakes, which is important. Let’s get the love going for Azeez!",LoisLaneEl,2023-11-03 22:57:47,"[('team performance', 0.42), ('coaching and management', -0.17), ('media coverage', -0.39)]"
