,id,Title,Content,Author,Post Date,cleaned_results
0,10578y3,Under attack by Jags fans in Florida,,nickelmedia,2023-01-06 22:13:55,"[('miscellaneous', 0.5)]"
1,107rjil,Titans fire OC Todd Downing,,Wide_Veterinarian100,2023-01-09 22:02:23,"[('team performance', 0.66)]"
2,s02697,The Indianapolis Colts have been officially eliminated from playoff contention.,FTC,wheredeyatdoe_,2022-01-09 21:32:58,"[('team performance', -0.11), ('coaching and management', -0.08), ('media coverage', -0.27), ('miscellaneous', -0.19)]"
3,s9krl8,The Tennessee Titans have Activated RB Derrick Henry to the Active Roster,,trick96,2022-01-21 20:58:28,"[('team performance', 0.34), ('stadium atmosphere', 0.43), ('miscellaneous', 0.17)]"
4,s62q4y,the gang starts a war,,Senator_Buttholeface,2022-01-17 12:17:28,"[('miscellaneous', 0.64)]"
5,rujjnx,THE TITANS OWN THE #1 SEED IN THE AFC,TITAN UP,Julonix,2022-01-02 21:11:00,"[('team performance', 0.44), ('coaching and management', 0.0), ('media coverage', -0.17), ('stadium atmosphere', 0.2)]"
6,s2yfff,It's a Hard Knock life #ForTheShoe,,TayJames2,2022-01-13 12:33:07,"[('miscellaneous', 0.4)]"
7,rws7bb,"Titans Move RB Derrick Henry to “Designated for Return from Injured Reserve"" List",,trick96,2022-01-05 17:32:11,"[('team performance', 0.21), ('coaching and management', 0.09)]"
8,ruiu1d,The 2021 Tennessee Titans are back-to-back AFC South Champions,Let’s get the party started.,trick96,2022-01-02 20:40:20,"[('team performance', 0.57), ('coaching and management', 0.64), ('stadium atmosphere', 0.25), ('pricing', 0.0), ('miscellaneous', 0.7)]"
9,zjohbk,This is my dad and me. He passed away tonight. He was the biggest Titan fan I’ve ever known. He bled two tone blue. Good bye sword head.,,SlawBoss,2022-12-12 05:28:03,"[('miscellaneous', 0.42), ('team performance', 0.29)]"
10,xivj8f,Pain,,slapdashjesse,2022-09-20 01:47:05,"[('team performance', -0.78), ('coaching and management', -0.6), ('miscellaneous', -0.33)]"
12,s3vbjr,losing to the jets is the coolest,,Senator_Buttholeface,2022-01-14 15:42:20,"[('team performance', 0.29), ('miscellaneous', 0.59)]"
13,yodmda,Officiating just keeps getting worse,,NewYorkDon,2022-11-07 05:20:13,"[('team performance', -0.08), ('coaching and management', -0.06)]"
14,s025g2,"He kept us in it when everyone else went down. Today, when we needed him most, he balled out and finished the job. Ryan Fucking Tannehill. That's it, that's the post.",,hereforpiercednips,2022-01-09 21:31:56,"[('team performance', 0.52), ('media coverage', 0.12), ('miscellaneous', -0.07)]"
15,s1c2cg,[OC] Garbage pail team,,everymanawildcat,2022-01-11 12:44:27,"[('miscellaneous', 0.08)]"
16,16x8ani,[Highlight] Derrick Henry breaks tackle after tackle for the TD,,nfl,2023-10-01 18:12:46,"[('team performance', 0.22), ('stadium atmosphere', 0.2)]"
17,17jb2e5,[Highlight] Levis throws his 4th TD to NWI.,,simbabeat,2023-10-29 19:53:48,"[('team performance', 0.37), ('coaching and management', -0.07), ('stadium atmosphere', 0.38)]"
18,yd75g9,Titans release renderings of new stadium,,Hextorm,2022-10-25 15:08:53,"[('team performance', -0.27), ('miscellaneous', 0.09), ('stadium amenities', 0.21), ('stadium atmosphere', 0.38), ('pricing', -0.08), ('coaching and management', 0.14)]"
19,y5ehoy,Coach has had enough of the league’s foolishness!,,udub86,2022-10-16 11:25:11,"[('coaching and management', 0.42), ('team performance', 0.02), ('miscellaneous', -0.22)]"
20,10ergyn,"Ladies and Gents, our guy is here, welcome our new GM, Ran Carthon to the sub.",,SweetPockets51,2023-01-17 23:40:16,"[('coaching and management', 0.65), ('miscellaneous', 0.13)]"
22,xbdmsb,"Game day in the UK, tale as old as time.",,Splinunz,2022-09-11 08:57:17,"[('stadium atmosphere', 0.69), ('miscellaneous', 0.03)]"
23,xhqzb0,common ground,,birdman133,2022-09-18 20:21:25,"[('miscellaneous', -0.03)]"
24,sary9l,Titans Defense appreciation post. no one would have expected them to carry the team to a division title and a #1 seed. they're scary as hell and they'll be back.,,d_trulliaj,2022-01-23 11:46:14,"[('team performance', 0.16), ('coaching and management', -0.24), ('pricing', -0.16), ('miscellaneous', 0.05)]"
25,ss0da3,"We're not so different, you and I...",,TheSauce4209,2022-02-14 03:13:50,"[('team performance', -0.17), ('coaching and management', -0.37), ('media coverage', 0.08), ('stadium atmosphere', 0.0), ('pricing', 0.0), ('stadium amenities', 0.0), ('miscellaneous', 0.1)]"
26,x9w4jm,Found this and thought it was hilarious,,Zoosee12,2022-09-09 13:52:47,"[('miscellaneous', 0.11)]"
27,12evq52,[TURRON DAVENPORT] The #Titans and Jeffery Simmons agreed in principle to a four-year contract extension. Simmons' agent @paulderousselle and GM Ran Carthon ensure the Titans will have their premier player for the long haul.,,_Dirty_Commie_,2023-04-07 19:06:21,"[('team performance', 0.45), ('coaching and management', 0.39), ('miscellaneous', 0.39)]"
28,spowj3,[Meirov] #Titans HC Mike Vrabel wins the 2021 Coach of the Year award after leading Tennessee to the No. 1 seed in the AFC despite a ridiculous number of injuries.,,Beast01973,2022-02-11 03:19:13,"[('team performance', 0.52), ('coaching and management', 0.42), ('media coverage', 0.09), ('miscellaneous', -0.19)]"
29,rv8yx9,The Titans disrespectfully gather on their own logo pre-game against the Dolphins.,,_COWBOY_DAN,2022-01-03 18:53:51,"[('stadium atmosphere', -0.57), ('team performance', 0.03), ('miscellaneous', -0.35)]"
30,17mm0rz,Silver Lining: Levis is the guy,,TiredDad1994,2023-11-03 03:35:18,"[('team performance', 0.43), ('coaching and management', 0.66), ('media coverage', -0.19), ('stadium amenities', 0.0), ('stadium atmosphere', 0.0), ('pricing', 0.0)]"
31,10tj3oa,‘Member this? The day Lewan became Dad.,,bawledannephat,2023-02-04 15:31:42,"[('team performance', 0.12), ('stadium atmosphere', 0.09), ('media coverage', -0.21)]"
32,zyjstl,"Shout out to Kevin Byard. The Mayor could've almost certainly taken tonight off. Every star is on the bench, the team is in disarray, they're going to take an ass kicking on national TV and he knows it. And the Cowboys are all dying to see him. And he's still going out there. Kevin Byard, we see you",,TayJames2,2022-12-29 23:16:39,"[('team performance', 0.52), ('stadium atmosphere', 0.13)]"
33,sab0zd,Little Watchparty in Germany,,GermanTitans,2022-01-22 20:14:16,"[('miscellaneous', 0.19)]"
34,s0k2xz,[Wyatt] 🚨Wardrobe check:🚨 The Titans will be decked out in sweats and on their couches all weekend because THEY’RE THE BEST F-ING TEAM IN THE AFC #WardrobeCheck,,TheMonsterUnderUrBed,2022-01-10 13:30:56,"[('miscellaneous', 0.06)]"
35,17evmvy,KB’s Farewell,,AcidicUrinal,2023-10-23 21:26:37,"[('team performance', -0.22), ('coaching and management', -0.01), ('miscellaneous', 0.25)]"
36,zct7vd,Treylon Burks appreciation post.,,air_volek07,2022-12-05 01:52:00,"[('team performance', 0.38), ('stadium amenities', 0.04), ('stadium atmosphere', 0.01), ('miscellaneous', -0.01)]"
37,zs3xk8,Ryan Tannehill appreciation post,"If last week was his last game as a Titan, I just want to say thank you Ryan! When you were traded here I didn’t think much of it, you won me over the day you beat the Chiefs in 2019. Thank You Ryan.",air_volek07,2022-12-21 22:43:05,"[('team performance', 0.38), ('coaching and management', -0.26), ('stadium atmosphere', 0.21)]"
38,s04n6n,Well deserved rest,,SexySlothy,2022-01-09 23:22:19,"[('miscellaneous', 0.39)]"
39,y0ezkj,"i mean, somebody's gotta be in first",,Senator_Buttholeface,2022-10-10 13:35:40,"[('miscellaneous', 0.18)]"
40,rujsp2,"Here’s Joe Burrow’s charity, the Athens County Food Pantry. Let’s send Burrow’s cause some love to say thanks for keeping us out of Arrowhead in the postseason.",,PraiseSaban,2022-01-02 21:25:16,"[('miscellaneous', 0.28)]"
41,107rkoz,[Rapoport] Titans have fired OC Todd Downing,,simbabeat,2023-01-09 22:03:33,"[('team performance', -0.41), ('coaching and management', -0.18)]"
43,xtz58s,🤫… I’m just gonna leave this here.,,derrick22henry,2022-10-02 20:37:14,"[('team performance', 0.35), ('stadium atmosphere', -0.18), ('media coverage', -0.12)]"
44,13ni924,A titans tattoo I got done last month in memory of my daughter who passed away last year.,"My daughter passed away on April 24th, 2022, so I got this a year later. She loved playing peek-a-boo with my hats, and this particular hat was the one I wore at the hospital where she passed. Several hours before she passed, she had woken up when we thought she would not wake up again, and immediately reached for our hats while we were crying and started playing peek-a-boo with it. She would hold the hat and drop it below our face so we all yelled out peek-a-boo when she drops it. She was smiling and laughing at it like not a care in the world. She probably played for up to 10 minutes before she fell back asleep and never woke up again. She would pass just hours later at 18 months old. 

I got this tattoo on April 25th of this year, and I've had one touch up done but I think it's got a little more to go because the shading of the front and bill of my hat is light gray and my skin doesn't seem to want to absorb the ink very well. Anyways, thanks for reading this if you've read it",broccolibush42,2023-05-21 04:00:23,"[('miscellaneous', 0.24)]"
45,s77dwm,We will make sure Cincinnati pays for what they did six years ago,,wetbandaid,2022-01-18 20:44:47,"[('miscellaneous', 0.02)]"
46,z6d8dy,Pain,,MrPainfulAnal,2022-11-27 21:30:58,"[('team performance', -0.46), ('coaching and management', -0.33), ('miscellaneous', -0.04)]"
47,107gua7,"Chigoziem Okonkwo appreciation post. 32 receptions, 450 yards, 14.1 avg, 3 TD. A rough season but definitely a bright spot for us going forward! #FTD",,assblaster68,2023-01-09 15:14:53,"[('team performance', 0.19), ('coaching and management', -0.12), ('miscellaneous', 0.32)]"
48,13fzpya,True Offseason Champs,,falconmarf,2023-05-12 22:51:40,"[('miscellaneous', 0.08)]"
49,rtn8wl,Happy new year: I’m told Derrick Henry is working out solo at the Titans facility full speed this week with no sign of any limp. He’s on track to be back full go for the playoffs.,,thewookieeman,2022-01-01 16:55:44,"[('team performance', 0.61), ('stadium atmosphere', 0.24), ('miscellaneous', 0.32)]"
50,ywe05u,SI with high praise for Vrabel.,,Jwiley129,2022-11-16 00:06:54,"[('team performance', -0.02), ('stadium amenities', 0.0), ('coaching and management', 0.46), ('media coverage', -0.36), ('miscellaneous', 0.11)]"
51,10eqct5,"[Russini] The Tennessee Titans are hiring San Francisco 49ers director of pro personnel Ran Carthon as their new general manager, sources me and @jeffdarlington",,joeking636,2023-01-17 22:55:34,"[('team performance', -0.05), ('media coverage', 0.08), ('stadium amenities', 0.12), ('coaching and management', 0.44), ('miscellaneous', 0.61)]"
52,107rzpf,Well it happened boys. I am a man of my word. Goodbye and I love you all. I’ll see you soon (Super Bowl),Bye boys.,Fire_Todd_Downing,2023-01-09 22:18:58,"[('miscellaneous', 0.05)]"
53,yyb586,Tannehill has the third most QB wins in the NFL since he became the starter here. He took over a 2-4 team. Ryan Tannehill is a difference maker.,,kentuckyruss,2022-11-18 04:34:59,"[('stadium amenities', 0.12), ('coaching and management', 0.15), ('media coverage', -0.04), ('team performance', 0.44)]"
54,y0j7jn,"After yesterday’s game, Tannehill has now made 48 consecutive starts for the Titans, passing McNair for the franchise record. GIMME A HOOTY HOO!",,CTParker14,2022-10-10 16:31:43,"[('team performance', 0.51), ('coaching and management', 0.22), ('miscellaneous', 0.03)]"
55,yhsiyu,New Touchdown King 👑,,-NotAnAdmin,2022-10-30 22:44:11,"[('team performance', 0.08), ('media coverage', -0.18), ('miscellaneous', 0.13)]"
56,157rov5,I agree with Taylor,,air_volek07,2023-07-23 22:01:07,"[('miscellaneous', 0.08)]"
57,x0veyj,[Brett Kern] Thank you Titans Family 💙,,TySoprano,2022-08-29 18:03:59,"[('miscellaneous', 0.73), ('team performance', -0.29)]"
58,s02sro,"[Rich Eisen] In the span of two weeks, the Colts went from the team nobody wanted to see in the playoffs to a team nobody is seeing in the playoffs.",,HenryTheTitan,2022-01-09 22:00:06,"[('team performance', 0.11), ('coaching and management', -0.28), ('media coverage', 0.29)]"
59,zucgdr,Rex Ryan on Todd Downing. Listen Vrabel,,jdezc,2022-12-24 15:50:32,"[('team performance', -0.23), ('coaching and management', -0.26)]"
60,s5ybuo,Chili Apparatuses,,mcclurc,2022-01-17 07:41:53,"[('miscellaneous', 0.36)]"
61,13r4ohu,Just a moment of your time to appreciate the King 👑,Dolly may be our queen but we know who the King of Tennessee is ,My_Balls_Smell_Like,2023-05-25 01:54:20,"[('team performance', 0.66), ('miscellaneous', 0.21)]"
62,ruj44l,"With their win over the Miami Dolphins today, Ryan Tannehill has officially beaten every team in the AFC at least once",,Benjaninja2,2022-01-02 20:52:15,"[('team performance', 0.39), ('media coverage', -0.09), ('miscellaneous', 0.39)]"
63,xy2541,It's a big brain move boys,,bgamer7,2022-10-07 15:31:06,"[('coaching and management', 0.09), ('team performance', 0.04), ('media coverage', -0.01), ('miscellaneous', 0.09)]"
64,s9fyxo,"Source: Derrick Henry to be activated, expected to start vs. Cincinnati Bengals",,SuccessfulJelly,2022-01-21 17:27:00,"[('team performance', 0.1), ('stadium atmosphere', 0.17), ('media coverage', 0.08), ('miscellaneous', 0.1)]"
65,s2gpg9,Kevin Byard finished the 2021 season as PFF’s top graded Safety overall.,,simbabeat,2022-01-12 20:56:37,"[('team performance', 0.36), ('media coverage', 0.14)]"
66,zn9phi,🫡,,derrick22henry,2022-12-16 08:18:03,"[('team performance', 0.14), ('coaching and management', 0.12), ('media coverage', 0.25), ('stadium amenities', 0.0), ('stadium atmosphere', 0.0), ('miscellaneous', 0.2)]"
67,17jb84t,4 TDs,,ldmb1966,2023-10-29 20:01:02,"[('team performance', 0.17), ('miscellaneous', 0.01)]"
68,s9buyz,Gotta love Titans #1 Media Supporter: Kyle Brandt,,NoTaro3663,2022-01-21 14:23:37,"[('media coverage', 0.33), ('stadium atmosphere', 0.29), ('miscellaneous', 0.18)]"
69,yvmbsq,The Eagles are now 0-1 since AJ Brown made this tweet,,MistaBarnacles,2022-11-15 04:06:13,"[('team performance', -0.28), ('media coverage', -0.05), ('miscellaneous', 0.15)]"
70,xiw6kv,I thought :(,,IronMango1,2022-09-20 02:15:33,"[('team performance', -0.01), ('miscellaneous', 0.02)]"
71,17q1m6m,"Vrabel: Levis is the starter, Tannehill is the backup.",,trick96,2023-11-07 19:01:29,"[('team performance', 0.06), ('coaching and management', 0.16), ('media coverage', -0.03), ('miscellaneous', 0.28)]"
72,s7vpmw,⚔️🐅This is Gold⚔️🐅,,FunkySwampDonkey56,2022-01-19 17:41:55,"[('miscellaneous', 0.55)]"
73,zuz7o0,"yaay, we're a laughing stock again.",,Civil-Transition-893,2022-12-25 14:35:07,"[('team performance', -0.63), ('coaching and management', -0.22)]"
74,u0qa13,Coach Vrabel with a savage response to Will Compton on twitter.,,mydogiscalledLeClerc,2022-04-10 20:29:44,"[('coaching and management', 0.04), ('media coverage', 0.1)]"
75,13hqupe,I made this meme to make fun of myself. I am the clown.,,DeyHateUsCuzDeyAnus,2023-05-14 23:28:53,"[('team performance', 0.26), ('coaching and management', 0.14), ('media coverage', 0.12)]"
76,13f64ow,[Tennessee Titans] We asked people on Broadway to help us with our 2023 schedule release. 🤣 📺: 2023 Schedule Release on @nflnetwork,,ReAlignTitan,2023-05-12 01:08:28,"[('media coverage', 0.29), ('miscellaneous', -0.07)]"
77,1037z53,3 Years ago today....Sigh....those were the days,,ministerman,2023-01-04 16:34:11,"[('team performance', 0.36), ('stadium atmosphere', 0.11), ('miscellaneous', 0.05)]"
78,sb7c3r,Tannehill,"I just read that apparently Tannehill has had people on social media threatening him and his family, wish he was dead, wishing he would have a career ending injury. If you are one of those types of fans you should walk away from sports. That type of shit ain’t needed these guys are human and have bad days. No need to wish harm or anything. That’s fucking childish as hell. Titanup fam it’s far from over we hit a bump but we’re coming back.",strickyricky88,2022-01-23 23:36:00,"[('team performance', -0.42), ('team performance', -0.06), ('team performance', 0.63), ('team performance', 0.3), ('team performance', -0.34), ('team performance', -0.61), ('coaching and management', 0.31), ('miscellaneous', 0.16), ('miscellaneous', -0.54), ('miscellaneous', -0.2), ('miscellaneous', 0.12), ('miscellaneous', 0.1), ('miscellaneous', 0.0), ('miscellaneous', 0.0), ('miscellaneous', -0.08), ('miscellaneous', 0.11), ('miscellaneous', 0.19), ('miscellaneous', -0.52), ('miscellaneous', 0.1), ('miscellaneous', 0.06), ('miscellaneous', -0.28), ('miscellaneous', 0.15), ('miscellaneous', 0.01), ('miscellaneous', -0.51), ('miscellaneous', 0.08), ('miscellaneous', -0.13), ('miscellaneous', -0.17), ('miscellaneous', 0.03), ('miscellaneous', -0.15), ('miscellaneous', 0.02), ('miscellaneous', -0.28), ('miscellaneous', -0.33), ('miscellaneous', -0.42), ('miscellaneous', -0.24), ('miscellaneous', -0.46), ('miscellaneous', -0.02), ('miscellaneous', 0.1), ('miscellaneous', -0.42), ('miscellaneous', -0.02), ('miscellaneous', -0.13), ('miscellaneous', 0.07), ('miscellaneous', 0.21)]"
79,uvpz0f,My favorite Titans moment,,KirkNJ,2022-05-23 02:17:43,"[('team performance', 0.16), ('miscellaneous', -0.05)]"
80,rzwv1g,That’s my Quarterback.,,SweetPockets51,2022-01-09 17:38:50,"[('miscellaneous', 0.14)]"
81,10j0cai,I aint worried about 17. Inspired by The Boy.,,TayJames2,2023-01-23 01:33:43,"[('team performance', -0.29), ('coaching and management', -0.17)]"
82,rxhyhq,I was re-watching the NFL top 100 and saw how much respect and credit Jonathan Taylor was giving to Derrick and it made me realize that us as fans of football (regardless of team) should give respect to great players.,,wave459,2022-01-06 16:02:24,"[('miscellaneous', 0.15), ('media coverage', -0.04)]"
83,10dih8w,The Titans have hired Rodd Upping as their new Offensive Coordinator.,,geegoj,2023-01-16 16:12:01,"[('coaching and management', -0.06), ('miscellaneous', 0.11)]"
84,t9wtfn,"The #Titans are signing OLB Harold Landry to a five-year, $87.5 million extension with $52.5M guaranteed, per sources",,TPoindexter,2022-03-09 01:57:22,"[('team performance', 0.07), ('coaching and management', 0.01), ('stadium atmosphere', 0.0), ('stadium amenities', 0.0), ('media coverage', -0.1), ('pricing', 0.06), ('miscellaneous', 0.18)]"
85,s0tcxi,"Lost in a season of injuries, Ryan Tannehill just became the first Tennessee Titans QB to start all regular season games in back to back seasons",This is just the second time it has happened in franchise history. The first time was McNair leading the short-lived Tennessee Oilers in the 1997 and 1998 seasons.,Unknown,2022-01-10 20:16:05,"[('team performance', 0.42), ('stadium atmosphere', 0.04), ('miscellaneous', -0.02)]"
86,xx65mi,Titans GameDay Poster Week 5 | 2022,,GermanTitans,2022-10-06 14:07:00,"[('miscellaneous', 0.27)]"
87,rznx14,Let’s get that 1 seed Boys!,,thc216,2022-01-09 09:24:35,"[('team performance', 0.05), ('stadium atmosphere', 0.35), ('miscellaneous', 0.22)]"
88,uebkhp,This is what I'm feeling how 'bout you guys?,,IveGotAYTChannel,2022-04-29 02:21:32,"[('team performance', 0.11), ('miscellaneous', -0.01)]"
89,10s0des,Tennessee introduces bill to dump Columbus Day as a holiday in favor of Super Bowl Monday,Soon to be known as TITANS DAY!!,Unknown,2023-02-02 20:46:04,"[('team performance', -0.35), ('coaching and management', -0.14), ('media coverage', 0.12), ('stadium amenities', 0.62), ('stadium atmosphere', -0.67), ('pricing', -0.52)]"
90,17q27id,Rest in Peace my sweet Prince,"Brought us out of the dark ages, I will forever hold your jersey with pride",Noahgrace4429,2023-11-07 19:27:42,"[('team performance', 0.13), ('coaching and management', -0.15)]"
91,zenqwk,Amy Adams Strunk appreciation post.,,air_volek07,2022-12-07 00:58:43,"[('coaching and management', 0.23), ('miscellaneous', 0.15)]"
92,wm77db,Malik Willis first NFL touchdown,,MemphisRaines47,2022-08-12 00:42:12,"[('team performance', 0.24), ('stadium atmosphere', -0.05), ('miscellaneous', -0.12)]"
93,s9g76n,Saiyan King Henry Rises,,Traubz,2022-01-21 17:37:09,"[('miscellaneous', 0.74)]"
94,s9w2md,Let’s get this divisional round fuckin started!!!,,thc216,2022-01-22 06:26:19,"[('stadium atmosphere', 0.65), ('miscellaneous', 0.41)]"
95,rum5d1,"Prince Foreman appreiciate post. Averaging over 80ypg in the last 5 games good for a 17 game pace of 1,404 yards 10 TDs ⚔️",,More_Advertising_383,2022-01-02 23:07:03,"[('team performance', 0.58), ('coaching and management', 0.17), ('miscellaneous', 0.43)]"
96,13xhofa,Long-Time Titans Punter Brett Kern Grateful for NFL Career as He Announces His Retirement,,trick96,2023-06-01 13:30:46,"[('team performance', 0.23), ('coaching and management', -0.18), ('media coverage', 0.18), ('stadium amenities', 0.0), ('miscellaneous', 0.13)]"
97,sa4fh6,When you order breakfast on game day and this is your number….it may be a sign.,,ZenoLoki,2022-01-22 15:07:29,"[('miscellaneous', 0.08), ('team performance', -0.23)]"
98,s6gjhl,[Wyatt] Jurrell Casey will be the Honorary 12th Titan for Saturday's Titans vs Bengals playoff game at Nissan Stadium.,,trick96,2022-01-17 22:13:47,"[('team performance', 0.44), ('stadium atmosphere', 0.36), ('coaching and management', 0.39)]"
99,sq2y90,Vrabel almost gets caught looking!?!,,jaylemi,2022-02-11 16:10:45,"[('miscellaneous', 0.25)]"
100,151ctfz,"[Russini] 3x All-Pro wide receiver DeAndre Hopkins is expected to sign with the Tennessee Titans, per sources. This is new Titans GM Ran Carthon’s first big splash. @DougKyed the first to report.",,AcidicUrinal,2023-07-16 17:58:54,"[('team performance', 0.26), ('media coverage', 0.24), ('stadium atmosphere', 0.25), ('pricing', -0.1), ('stadium amenities', 0.13)]"
101,yykjew,[McCormick] Not a great way to celebrate a big win in Green Bay.,,randomwarlord,2022-11-18 13:49:46,"[('team performance', -0.47), ('coaching and management', -0.16), ('miscellaneous', 0.16)]"
102,xjnx2b,Petition to change logo,,SilentMase,2022-09-20 23:19:05,"[('miscellaneous', 0.34)]"
103,zt2ey1,Thoughts on a logo redesign?,,Unknown,2022-12-23 01:02:37,"[('miscellaneous', -0.14)]"
104,yl5w2t,[OC] Time for a Showdown,,mcclurc,2022-11-03 15:34:14,"[('miscellaneous', 0.69)]"
105,xdgouy,The Boger Circus,,milk_sauce,2022-09-13 19:47:39,"[('team performance', -0.85), ('coaching and management', 0.16)]"
106,uf1mjp,"With the 86th pick of the 2022 NFL Draft, the Tennessee Titans select Malik Willis, QB, Liberty",The Titans traded picks 90 and 169 for the 86th pick to take Willis.,trick96,2022-04-30 02:31:50,"[('team performance', 0.27), ('coaching and management', 0.44), ('media coverage', 0.18)]"
107,10l4xqo,I Turned My Weekly Titans Doodles Into Stickers :) [CornDoggyLOL],,CornDoggyLOL,2023-01-25 17:58:31,"[('miscellaneous', 0.57)]"
108,rwbzp1,He's back.,,Stoopkidnahmean,2022-01-05 02:44:16,"[('miscellaneous', 0.61)]"
109,sb1qoy,The ultimate sad song Sunday,,D0ng0saurusRex,2022-01-23 19:33:00,"[('team performance', -0.54), ('coaching and management', -0.07), ('miscellaneous', -0.11)]"
110,17j80rs,[Highlight] Will Levis' first TD is also Deandre Hopkins' first touchdown as a Titan.,,simbabeat,2023-10-29 17:34:33,"[('team performance', 0.58), ('stadium atmosphere', 0.31), ('media coverage', -0.63)]"
111,snuqlf,Titans Extend Contracts for GM Jon Robinson and HC Mike Vrabel,,trick96,2022-02-08 21:01:05,"[('coaching and management', 0.67), ('team performance', 0.78), ('miscellaneous', 0.65)]"
112,s02b3w,RAVENS WONT MAKE THE PLAYOFFS EITHER,AHHHHHHH,Unknown,2022-01-09 21:38:48,"[('team performance', -0.17), ('team performance', 0.54), ('team performance', 0.61), ('team performance', 0.08), ('team performance', -0.56), ('team performance', -0.05), ('team performance', 0.32), ('team performance', -0.18), ('team performance', -0.8), ('team performance', -0.52), ('team performance', 0.07), ('team performance', 0.16), ('team performance', -0.72), ('team performance', 0.53), ('team performance', 0.19), ('team performance', -0.09), ('team performance', -0.86), ('team performance', -0.57), ('team performance', 0.6), ('team performance', 0.69), ('team performance', 0.35), ('team performance', -0.52), ('team performance', 0.65), ('media coverage', 0.38), ('miscellaneous', 0.9), ('miscellaneous', 0.88), ('miscellaneous', 0.35), ('miscellaneous', -0.03), ('miscellaneous', 0.88), ('miscellaneous', 0.82)]"
113,11vu4z1,Byard appreciation post,,BuffaloKiller937,2023-03-19 18:57:52,"[('team performance', 0.56), ('miscellaneous', 0.36), ('miscellaneous', 0.71), ('miscellaneous', 0.64), ('miscellaneous', 0.29), ('miscellaneous', 0.87), ('miscellaneous', 0.78), ('miscellaneous', 0.68), ('miscellaneous', 0.74), ('miscellaneous', 0.81), ('miscellaneous', 0.76), ('miscellaneous', 0.83), ('miscellaneous', 0.78), ('miscellaneous', 0.89), ('miscellaneous', 0.9), ('miscellaneous', 0.83), ('miscellaneous', 0.82), ('miscellaneous', 0.87), ('miscellaneous', 0.73)]"
114,12ewy35,"[Rapoport] The #Titans and star DL Jeff Simmons have agreed to terms on a monster 4-year extension worth $94M, sources say. That’s $23.5M per year based on new money. 💰 💰 💰",,AcidicUrinal,2023-04-07 19:46:29,"[('team performance', 0.38), ('coaching and management', 0.34)]"
115,xmzlij,Everything That Could Go Wrong Has 😥,,IronMango1,2022-09-24 18:00:51,"[('team performance', -0.07), ('coaching and management', 0.19), ('stadium atmosphere', 0.07), ('pricing', 0.17), ('miscellaneous', -0.07)]"
116,17tsh9g,Pain.,,slapdashjesse,2023-11-12 20:08:40,"[('team performance', -0.32), ('stadium atmosphere', -0.38), ('coaching and management', -0.15)]"
