,id,Title,Content,Author,Post Date,cleaned_results
1196,scp3w4,I honestly think the titans will trade from Wilson or Rodgers,"Just look at the Rams trading for Stafford. JRob knows the window is now and tanny ain’t it. Get a much better QB while we can. Tannehill is basically Goff

Edit: for, not from in title",Unknown,2022-01-25 22:00:26,"[('team performance', 0.06), ('coaching and management', 0.09), ('pricing', -0.07)]"
1197,103zy96,/r/jaguars invites you to our sub for some friendly TRASH TALK,,flounder19,2023-01-05 14:15:34,"[('team performance', -0.6), ('coaching and management', -0.18), ('media coverage', -0.08)]"
1198,zerhvc,JRob Denies AJ Brown the Dragon Scroll,,benderty,2022-12-07 04:03:51,"[('miscellaneous', 0.45)]"
1199,uhgxe2,CBSSports has the Titans at #16.,,perfect_fitz,2022-05-03 14:08:13,"[('team performance', 0.09), ('media coverage', -0.12), ('pricing', 0.06), ('miscellaneous', -0.06)]"
1200,10ar9ob,I will take bets Malik doesn't make it,"This is the NFL, If a guy cant throw or check down that is hard to fix.  Zach Wilson and Trey Lance can throw they didnt make them even a starting QB. I can name 10-1 of QB's over the years that didnt look like they had it and surprised people. I liked the Malik pick but I am realistic. So yall hold on to BUT THERES A CHANCE",Hairy-Conflict717,2023-01-13 10:30:00,"[('team performance', -0.11), ('coaching and management', 0.18), ('media coverage', 0.03)]"
1201,wh00e8,ESPN ranking of O-Lines… this season probably won’t go the way we want it to,,Nestormahkno19d,2022-08-05 16:37:00,"[('team performance', -0.08), ('coaching and management', 0.11), ('media coverage', -0.2)]"
1202,16rjo89,Can we hand the keys to Malik?,"I understand our opinions have absolutely no bearing on what happens within the Titans organization but to be fair Tanny is done after this year. He will probably retire and I think every Titans fan would still love him for bringing the franchise back to life. At the same point this team, in no way shape or form is even coming close to the AFC championship. I honestly wouldn’t mind seeing Malik in and getting to see what he can do in an offense that is willing to actually pass the ball on 3rd and 8 unlike last season. 

If the Titans are going to lose (which sadly they probably are) I’d like to see what some of the young guys have. And if they suck as well then maybe there is hope in getting a QB in the draft. I don’t know. The past two season every game looks like the defense is doing every thing they can and the offense just plain and simply looks terrible and flat.",zhurithebear,2023-09-25 05:41:19,"[('team performance', -0.27), ('coaching and management', -0.21)]"
1203,16stwik,My Take on Starting Will Levis,"I think it is time to start Will Levis at QB. My reasoning is:

1.) Ryan Tannehill has peaked as a QB, and he is not capable of elevating our offense to an elite level.

2.) Our offense & pass defense are both very bad, and even if they reach average levels, and we somehow win the division, they will not be good enough to compete in the playoffs. 

3.) If we bottom out and get a top 3 pick, we should at least see what Levis has to offer in regular season games before picking another QB in the draft. Otherwise, we effectively wasted the 33rd pick in the 2023 Draft. Malik Willis may be more competitive than Will Levis right now, but I don’t see any situation where we pass up on Williams or Maye if we have a top 3 pick.",OGTITANSFAN,2023-09-26 17:17:41,"[('team performance', -0.34), ('coaching and management', 0.11)]"
1204,105zlv9,This is not a win-win scenario game,"If it was, we wouldn’t be nervous about the result. We need to win. 7 game losing streak is inexcusable (so is a 6 game streak). If we lose and get a top ten pick we will screw that up so let’s get a win, make the playoffs and maybe sneak in another W in the wild card round. Go Titans! Henry needs a monster game and redeem himself for his backbreaking fumbles in the jags and Texans game.",Nyctitan,2023-01-07 21:03:19,"[('team performance', 0.28), ('stadium atmosphere', -0.16), ('pricing', -0.13), ('miscellaneous', 0.17)]"
1205,104jo0l,Good Analysis of Malik Willis, [What The NFL Doesn't Want You To Know About Malik Willis... - YouTube](https://www.youtube.com/watch?v=L9Q4IGHHoKk),Confused_Hominoid,2023-01-06 03:39:55,"[('team performance', -0.43), ('coaching and management', 0.0), ('media coverage', 0.21)]"
1206,wybkvv,Anybody else worried about no reps for starters?,"It seems like a lot of the starters might not get any reps this Saturday. Tannehill, Henry, Woods, etc. Haven't gotten any game work this preseason. Anybody else worried about a lot of the starters not getting any game time reps during preseason? If I remember correctly, they didn't get any reps last preseason either and they came out week 1 looking like a high school team. Hoping that's not the case this year.

Most teams around the league seem to be playing their starters for at least a quarter this week but it seems like Vrabel may not go that route.

Thoughts?",Mainstay012,2022-08-26 15:06:32,"[('team performance', -0.06), ('coaching and management', 0.21), ('stadium atmosphere', -0.13), ('miscellaneous', 0.12)]"
1207,uecbs9,From the titans insta…vrabel gonna go to snoop Dogg’s later (smoking weed),,Unknown,2022-04-29 03:01:45,"[('miscellaneous', 0.0)]"
1208,sb47bu,We need to do a trade with Tannehill like the Rams did for Goff with Stafford,"Lost terribly in the divisional last year, accepted their QB wasn’t it, and are now likely going to the SB",HenryTheTitan,2022-01-23 21:19:53,"[('team performance', -0.05), ('coaching and management', -0.07), ('pricing', 0.2), ('media coverage', 0.04), ('stadium atmosphere', 0.0)]"
1209,xcujj5,Terry Robiskie,To those of you that are whining about how terrible downing play calling is have forgotten how infuriating the coaching staff before with robiskie and malarkey were. Who were INTENT on giving the ball to Murray up for middle where he would stumble after one yard because he was obviously super old and washed and was honestly never that good in Tennessee I said it. While ALSO wasting Henry’s early years when he was obviously way better and I remember being one of the only titans fans at the time crying for them to put Henry in at the game. So before you freak out it’s week 1 it didn’t go our way but the grass is not always greener on the other side . And we were 12-4 last year . Can’t win every game! You could but seriously..,Payphone3,2022-09-13 01:43:26,"[('team performance', -0.32), ('coaching and management', -0.09)]"
1210,xq1toi,Can we tone things down a bit?,"Y’all we are way overreacting to the season so far.


There have been 3 games played. 


Even in the year where Vrabel benched Mariota to go to Tannehill, is was week 6 when we went on to be shut out, and were 2-4. 


That’s the baseline for panic, and we aren’t there. We are 1-2 (could easily be 2-1 if the FG went through). We have looked sloppy and definitely have problems, but we aren’t a dumpster fire. Let’s just try and chill a bit at let things play out.",Markosaurus,2022-09-28 03:44:20,"[('team performance', 0.46), ('miscellaneous', -0.11)]"
1211,14alwl9,According to Buck Reising the Titans have NOT offered Hopkins a contract,He says this is fake news on his show and Twitter,HenryTheTitan,2023-06-16 03:32:00,"[('media coverage', 0.05), ('miscellaneous', 0.15)]"
1212,133eoby,Levis the next Josh Allen?,"Not a serious comparison but I came across this article and had no idea bills fans were so anti-Allen when he was first picked. All I’m saying is, let’s give Will a chance cause who knows.",strongmarshall,2023-04-30 03:27:50,"[('team performance', 0.21), ('pricing', 0.09)]"
1213,131a3bj,[Giardi] Want another team that is fond of Will Levis? I'm told the #Titans didn't get the same vibe other teams did in their meetings with the Kentucky QB. They liked him. A bunch. Might he end up as Ryan Tannehill's successor?,,air_volek07,2023-04-27 22:50:36,"[('team performance', -0.08), ('coaching and management', 0.09), ('stadium atmosphere', -0.17), ('pricing', 0.11), ('media coverage', 0.07), ('miscellaneous', -0.05)]"
1214,11knehc,Revenge,,Unknown,2023-03-07 03:12:09,"[('miscellaneous', 0.0)]"
1215,uhuoe7,AJ Brown’s contract. I saw this posted on the Eagles sub.,,Titans79,2022-05-04 00:54:50,"[('team performance', -0.05), ('coaching and management', -0.01)]"
1216,ytaa48,Should we cut Dupree?,"Should we cut Bud Dupree after the season? We can save over 10 million in 2023 alone. There is no denying he makes an impact on the field but his availability is absolutely terrible. He missed 6 games last year along with multiple games he left in the first quarter. Tomorrow he will miss his 3rd game this season sofar and he left in the first quarter against the Chiefs.  To me his availability has caused him to grossly underperform his contract.

[View Poll](https://www.reddit.com/poll/ytaa48)",panopticon31,2022-11-12 15:35:51,"[('team performance', -0.14), ('coaching and management', 0.14)]"
1217,y3j6h7,Caleb Farley,Let me know how you guys feel about him. He gets 10-15 snaps a game and gets burnt repeatedly. I know he’s bad and so does every NFL QB. So let’s hear your honest opinions,pesoooooooooo,2022-10-14 03:50:08,"[('team performance', -0.24), ('coaching and management', -0.33), ('media coverage', -0.38)]"
1218,ss50yw,It ended the way *we* knew it would,"Titans legit could have beaten the Rams tonight, at home, but.....Todd Downing's inability to call plays left the SB hopes to the worst AFC team in the playoffs. Damn....",Unknown,2022-02-14 07:39:16,"[('team performance', -0.16), ('coaching and management', -0.25)]"
1219,139zwqh,Does anyone else feel this way,I feel that Ryan Tannehill kind of resembles Aladar from the movie “Dinosaur.” This is not meant in a disparaging way—both of them have great bone structures.,Peanut_otter,2023-05-06 19:40:19,"[('miscellaneous', 0.11)]"
1220,16iyd8o,Elite Defense,"Of course all the talk this week is about the offense and qb, but I wanted to talk about our defense and what it is missing to be a top 5 D. 

We desperately need a #1 corner. Even when Fulton is healthy he is a #2. I love Byard as all of us do, but would that money not be better spent on a shutdown corner? Average safties can suffice if the corners are covering well. Thoughts??",shershae,2023-09-15 00:12:12,"[('team performance', -0.08), ('coaching and management', -0.07), ('stadium atmosphere', 0.1)]"
1221,10vbh8p,4 grossly overpaid Tennessee Titans players on current 2023 salary cap,,casiokvik,2023-02-06 16:51:46,"[('coaching and management', -0.33), ('team performance', 0.12), ('pricing', 0.14)]"
1222,z6enq6,"So our win streak of Derrick Henry catching a ball ends, Vrabel is no longer undefeated coming off a week after Thursday night games, for some reason this team folds terribly against Joe Burrow, and that last penalty to end was horrible and exactly why I hate officiating so much.","Was really upset with that final penalty during the game that cost the Titans a chance, from what I saw the long snapper was slightly knocked back and made the refs look completely blind as to what they were seeing. So we've been robbed of potential winning games against the Chiefs and Bengals, and officiating in the league is getting horrendous this season. Also we're 0-3 against Joe Burrow now, and it's starting to feel like the whole Andrew Luck losing streak again. 

We got the Eagles next week, which means the game we've all had circled on our calendar is coming up. With how Kristian Fulton looked today, don't know how positive I feel for him next week against AJ Brown.",Officer_Zack,2022-11-27 22:25:24,"[('team performance', -0.75), ('coaching and management', -0.22)]"
1223,128q3e4,If you have to choose 🤔,"I myself have appreciated what Henry has done and meant to the franchise. That said, if the choice was to keep him or replace him with Gibbs...what would you do?",HI_0218,2023-04-01 15:45:51,"[('team performance', 0.17), ('coaching and management', 0.05), ('media coverage', 0.04), ('miscellaneous', 0.43)]"
1224,yjk30a,Would we be the #1 seed in the AFC if Isaiah Wilson panned out and Lewan wasn’t injured?,And we can throw some more names in there. Let’s say Harold Landry wasn’t injured. How good would we be?,Antiochboy,2022-11-01 20:19:44,"[('team performance', -0.17), ('coaching and management', -0.05), ('miscellaneous', 0.06)]"
1225,uebx1j,Mismanaged trade. A blunder.,"You’re telling me the Jets wouldn’t have taken AJ for the 10th and we could have gotten a better receiver? Or the commanders?? You’re telling me even the falcons wouldn’t have done the straight up?? I would gladly give that 3rd back to upgrade that receiver to a truly premier guy. 

We gave AJ Brown for the SIXTH receiver in the round.

Poor Treylon Burks. Anything short of spectacular and he will be the most hated guy in Nashville.",CapableRunts,2022-04-29 02:39:39,"[('team performance', -0.06), ('coaching and management', -0.09), ('miscellaneous', 0.07)]"
1226,15e0jd6,What no football does to a mf,,pornwing2024,2023-07-30 23:55:50,"[('miscellaneous', 0.15)]"
1227,14esz0e,Who's are biggest liability on O-line?,I feel like it's between undersized Aaron Brewer and Nicholas Petit-Frere.,Unlikely_Ad148,2023-06-21 00:57:35,"[('team performance', 0.04), ('coaching and management', -0.12)]"
1228,wxw577,2022 Sideline hats,Am I the only one that's not a fan of the sideline hats for this year?,AeroForce1997,2022-08-26 01:51:10,"[('stadium amenities', -0.74), ('coaching and management', -0.36), ('miscellaneous', -0.33)]"
1229,u1gvzj,Tennessee Titans: 3 bold predictions in the 2022 NFL Draft,,muddyklux,2022-04-11 20:35:22,"[('miscellaneous', 0.08), ('team performance', -0.01), ('coaching and management', 0.01)]"
1230,zqc48f,Vrabel's biggest problems,"I have been listening and watching closely this year because I do have a problem with Downing. Some glaring issues everyone sees in his play calling Vrabel should notice. Then Vrabel was 2 or 3 words away today from saying playcalling is overrated....so hear me out. 

Vrabel was a Defensive player and coach. Defensive play callers do not need to be as savvy as offensive play callers. Some are but it's not a necessity Vrabel is/was not a good DC either. 

So I believe Vrabel's biggest problem is he does not understand what the difference is between Arthur Smith and Todd D. He believes anyone just needs to call a play and players need to execute. He doesn't understand the nuance of using the run to set up PA. Or airing it out to set up the run. He is stuck in a Defensive mind where they have a handful of schemes and it's about player execution. Not how those schemes are called, as long as the call gets in ontime the play caller did their job (another Vrabel quote) 

Also I am starting to get really disappointed in him for not praising Chig. Dude is our top performer and Vrabes says chig needs to improve on the line but he does great on Special Teams. 

Rant over just irritated....",jacob0601,2022-12-20 02:49:26,"[('coaching and management', 0.12), ('team performance', -0.25), ('media coverage', 0.09)]"
1231,16co2zl,Why so sensitive?,"Why is this fanbase so sensitive? Every time a rival shows up rated high on a power ranking or a prediction, everyone loses their shit? Oh the Jags are higher than us? People lose their minds. Look at Vegas. They're not always right but they're right more than most people. 

They also had the writer of the NFL.com power rankings on McAfee last year and he even was quoted as saying the Titans fanbase is the most ruthless and sensitive to the rankings. Why? It's a fucking ranking! You realize people would shit allover each and everyone of us if we posted national rankings as well. They're conversation pieces. 

Every year we see so many posts begging for national media attention, when we get it, people say they don't want it. If we get shit on by the media, it drives people wild. Why?

Let's realize what these things are for what they are. Opinion pieces. We all have opinions. Opinions aren't facts. Predictions and power rankings mean nothing and are in fact, not factual.

Allow opinions to happen and we don't need to look so sour when a rival is ranked or predicted higher than is. We're better than that. This is what makes sports so great. Millions of fans are into 32 different teams. No one will ever agree on something, but stop being so salty if you see praise for the Jags or something like that.",shoe1113,2023-09-07 19:37:22,"[('team performance', 0.09), ('coaching and management', 0.38), ('media coverage', -0.22)]"
1232,11k5czj,This has been an exciting day for me.,"I know a lot of you are probably stressed with the Derrick Henry trade talks and shit, but this means that Ran wants his own shit and is planning for the future, and he’s starting quick and aggressively. Trading Henry is the right thing to do. For the team and also for Derrick himself. Im also on team cut tannehill. For the record. Future is bright guys. Maybe not next season, but the future is bright.",imlowkeyloki1,2023-03-06 17:18:22,"[('team performance', -0.25), ('coaching and management', 0.13), ('stadium atmosphere', 0.07), ('pricing', -0.06), ('media coverage', -0.14)]"
1233,11sgkkf,Unpopular Opinion: I would take Dennis __l_y back at LT,,Libertatia_Forever,2023-03-16 01:49:59,"[('miscellaneous', 0.05)]"
1234,ylg8uz,AJ Brown Patch- $5 Shipped,,Lost_Size8599,2022-11-03 22:12:33,"[('pricing', 0.08), ('stadium amenities', -0.05)]"
1235,sgngee,I’m beginning to believe these conspiracy theorists about the NFL.,No team had ever hosted a super bowl until last year.  Now the Rams are likely going to do it again this year. Crazy coincidence.  But for a fun conversation what are some of y’all’s best theories Or things that “add” to your belief that the NFL is staged?  Obviously it’s not but what’s your best evidence for that.,Titansguy12,2022-01-31 00:32:40,"[('team performance', 0.18), ('media coverage', 0.04), ('miscellaneous', -0.07)]"
1236,16b6x07,What’s up with the media hyping up the Jaguars?,"Am I crazy or are people thinking the Jaguars are good? They barely made the playoffs last year but they have them winning the AFC south and some rankings have them in the top ten! They have won like 13 games total the last three seasons. Someone help me!

The amount of disrespect i see the Titans get just reminds that football season is here!

Edit: Damn didn’t know I was in the jaguars sub, a lot of you guys are sus. Titan up!",RandomVengeance1,2023-09-06 01:34:12,"[('team performance', -0.16), ('coaching and management', -0.13), ('media coverage', 0.05), ('stadium atmosphere', 0.08), ('miscellaneous', 0.01)]"
1237,12lqsu4,TIL Tim Kelly has a brother who played for the Titans. A backup left tackle named Dennis wearing number 71...,"No, the other one.",falconmarf,2023-04-14 09:15:17,"[('team performance', -0.72), ('coaching and management', -0.1)]"
1238,11kmkgy,Anyone else concerned that the past tense of “Run” is ___ ??? 🤯😩😭,2023 Slogan: “Who Ran It”,baby_NayNay,2023-03-07 02:35:49,"[('miscellaneous', 0.06)]"
1239,x8pp7b,How do you feel about this season?,"For me, I’m feeling the letdown blues still from last year. 

I know this probably isn’t a popular opinion, but between the weakened O-Line, WR corps and Landry’s injury, I’m not really feeling optimistic about our season. 

Hopefully we win the Division, or at least get a wild card, but I don’t see us getting out of the Divisional Round this year. 

I know another winning year and playoff year is more than most teams will get, but it just feels like we’ve taken a step down since last year, and the bust of Isiah Wilson is really coming back to bite us in the ass. 

I sincerely hope I’m proven wrong, but it just feels like we’re in for the same old same old right now.


EDIT: If we draft a starting RT instead of Wilson, the combination of Radunz (2nd Rd OT, now OG) and Petite-Frere (3rd Rd current starting RT) would not have been drafted over the last two years, thereby freeing up either a 2nd or a 3rd round draft pick for another position like WR where we would be more complete.",Markosaurus,2022-09-08 03:51:15,"[('team performance', -0.16), ('coaching and management', 0.3)]"
1240,16itwem,Tannehill to be Benched? A Speculative Timeline for the Titans QB Room,"Hey everyone, this is an article I wrote recently for Titan Sized, and I genuinely want to know what you guys think about the Tannehill situation. Especially with the recent reports from Rapsheet, I think its very possible Tannehill gets benched, although I don't know how much I buy into Rappoport's insider info considering how stingy Tennessee is with the media.",W1ldW3st1,2023-09-14 21:05:02,"[('team performance', -0.11), ('coaching and management', 0.09)]"
1241,13yvjnj,Richardson vs Levis target drill viral video.,"Have to defend our young backup QB here. I’m seeing a lot of videos of people comparing Richardson hitting a target on a drill and Will missing on a different drill. These 2 drills are completely different. Will has to go through bags with his back to the target, not even knowing where the target is, when he gets to the end and turns around the coach yells which target he wants him to hit a millisecond before he throws the ball. It’s a ridiculously difficult drill, Tannehill couldn’t even make one. Richardson is just hitting a target on a run staring it down the whole time? It’s so much easier.

Side note: Levis looked much better than Richardson with a worse cast last year when they faced each other.

TITAN UP

[https://twitter.com/ntolliver1987/status/1664693517183078402?s=61](https://twitter.com/ntolliver1987/status/1664693517183078402?s=61)",TitanFan0521,2023-06-03 01:01:51,"[('team performance', 0.01), ('coaching and management', 0.02), ('miscellaneous', -0.07)]"
1242,12pfmm9,Anthony Richardson,"Rumor has it we’re poised to take him at 11. Please for the love of all that is pure, do not take him. We don’t need two Malik’s on the roster. Do not buy into hype again Tennessee, he’s not our guy. Draft a lineman or receiver, I’d even take Hooker if he’s available in the second. Nothing about Anthony is sold on me. Bc he threw the bar far in a shirt and shorts to open receivers he’s the next big thing? I recall Zach Wilson doing the same and look at him, he even has talent around him and veterans to learn from he’s just trash. If we have any chance of being contenders we need to let this man go to the Colts 😂",skittlesmalone,2023-04-17 13:16:03,"[('team performance', -0.05), ('coaching and management', 0.03), ('media coverage', -0.17)]"
1243,11dotlv,BREAKING: Titans coach leaving team for Chicago Bears,,YiMyonSin,2023-02-27 22:24:32,"[('coaching and management', 0.06), ('miscellaneous', 0.17)]"
1244,118flsu,Derrick Henry Fan art. What do you think?,,yungblud_freak,2023-02-21 21:28:55,"[('miscellaneous', -0.2)]"
1245,xpdiy8,Just sort of a reminder notice to other fans: NY Giants and the Bills are pretty good teams.,"At this point in the season, a lot of people have started giving up on the Titans, but I want to remind everyone that both of their losses were to waht appears to be playoff worthy teams. A lot of people complained about the Titan's run D against the Giants, but as we have seen against teh Cowbys and recent history, Saquan barkely is a beast and not at all easy to stop. In other words, the Giants have a superb running game. As for the Bills, they have been regular contenders in teh playoffs the last several years and there offense is almost always on point. While I personally don't believe the team has what it takes this year to win it all, primarily due to the same issues they have always had (excessively fancy play calling, pseudo predictability, and hybrid offensive scheme), their prospects aren't as bad as people make them out to be.",football_revealed,2022-09-27 10:59:38,"[('team performance', -0.3), ('pricing', 0.23), ('coaching and management', 0.5), ('media coverage', -0.21), ('miscellaneous', -0.14)]"
1246,16fxjyk,"In July, Bleacher Report Predicted Andre Dillard Would be our Biggest Bust. So far, seem pretty reasonable.",,neimsy,2023-09-11 15:01:36,"[('team performance', -0.12), ('coaching and management', -0.16)]"
1247,ugkhoj,PFF - AJ the most productive start to a career that PFF has ever seen…,,twissy88,2022-05-02 07:54:05,"[('team performance', -0.07), ('coaching and management', -0.44)]"
1249,ztvgwe,Which of you did this lmao,It’s not wrong tho,Unknown,2022-12-23 23:11:58,"[('team performance', -0.32), ('coaching and management', -0.25), ('stadium atmosphere', 0.08), ('miscellaneous', -0.19)]"
